id,title,release_date,poster_path,popularity,overview
9738,Fantastic Four,2005-06-29,/4YMcYEFS8sFuW3soP1HVmgR3cSm.jpg,13.5078,"During a space voyage, four scientists are altered by cosmic rays: Reed Richards gains the ability to stretch his body; Sue Storm can become invisible; Johnny Storm controls fire; and Ben Grimm is turned into a super-strong … thing. Together, these ""Fantastic Four"" must now thwart the evil plans of Dr. Doom and save the world from certain destruction."
507089,Five Nights at Freddy's,2023-10-25,/4dKRTUylqwXQ4VJz0BS84fqW2wa.jpg,13.4805,"Recently fired and desperate for work, a troubled young man named Mike agrees to take a position as a night security guard at an abandoned theme restaurant: Freddy Fazbear's Pizzeria. But he soon discovers that nothing at Freddy's is what it seems."
615656,Meg 2: The Trench,2023-08-02,/4m1Au3YkjqsxF8iwQy0fPYSxE0h.jpg,13.4802,An exploratory dive into the deepest depths of the ocean of a daring research team spirals into chaos when a malevolent mining operation threatens their mission and forces them into a high-stakes battle for survival.
4935,Howl's Moving Castle,2004-09-09,/23hUJh7JdO23SpgUB5oiFDQk2wX.jpg,13.4737,"Sophie, a young milliner, is turned into an elderly woman by a witch who enters her shop and curses her. She encounters a wizard named Howl and gets caught up in his resistance to fighting for the king."
497698,Black Widow,2021-07-07,/7JPpIjhD2V0sKyFvhB9khUMa30d.jpg,13.4591,"Natasha Romanoff, also known as Black Widow, confronts the darker parts of her ledger when a dangerous conspiracy with ties to her past arises. Pursued by a force that will stop at nothing to bring her down, Natasha must deal with her history as a spy and the broken relationships left in her wake long before she became an Avenger."
1241752,Rita,2024-03-22,/pXENxAzOBrTSDJGxDcUnlNTNmWr.jpg,13.4479,"Rita, who finds herself alone when husband Ariel works abroad. They both find solace and sexual satisfaction in other people. When Ariel comes back, they both act like nothing happened. But will this keep their marriage from falling apart?"
547513,Chespirito: El Niño Que Somos,2001-01-10,/fBK5YTjBtyNTyToENeuSQHmLtgF.jpg,13.3607,"As a child, Roberto Gómez Bolaños dreamed of being a soccer player or an engineer; acting seemed ridiculous to him. But as time went by he discovered his true calling. First as a writer and then as an actor, he gave life to several characters, including two of the most popular in the history of Mexican television."
12155,Alice in Wonderland,2010-03-03,/o0kre9wRCZz3jjSjaru7QU0UtFz.jpg,13.3271,"Alice, now 19 years old, returns to the whimsical world she first entered as a child and embarks on a journey to discover her true destiny."
787699,Wonka,2023-12-06,/qhb1qOilapbapxWQn9jtRCMwXJF.jpg,13.3168,"Willy Wonka – chock-full of ideas and determined to change the world one delectable bite at a time – is proof that the best things in life begin with a dream, and if you’re lucky enough to meet Willy Wonka, anything is possible."
490132,Green Book,2018-11-16,/7BsvSuDQuoqhWmU2fL7W2GOcZHU.jpg,13.3099,"Tony Lip, a bouncer in 1962, is hired to drive pianist Don Shirley on a tour through the Deep South in the days when African Americans, forced to find alternate accommodations and services due to segregation laws below the Mason-Dixon Line, relied on a guide called The Negro Motorist Green Book."
718821,Twisters,2024-07-10,/pjnD08FlMAIXsfOLKQbvmO0f0MD.jpg,13.2919,"As storm season intensifies, the paths of former storm chaser Kate Carter and reckless social-media superstar Tyler Owens collide when terrifying phenomena never seen before are unleashed. The pair and their competing teams find themselves squarely in the paths of multiple storm systems converging over central Oklahoma in the fight of their lives."
953,Madagascar,2005-05-25,/zMpJY5CJKUufG9OTw0In4eAFqPX.jpg,13.2864,Four animal friends get a taste of the wild life when they break out of captivity at the Central Park Zoo and wash ashore on the island of Madagascar.
218,The Terminator,1984-10-26,/hzXSE66v6KthZ8nPoLZmsi2G05j.jpg,13.2754,"In the post-apocalyptic future, reigning tyrannical supercomputers teleport a cyborg assassin known as the ""Terminator"" back to 1984 to kill Sarah Connor, whose unborn son is destined to lead insurgents against 21st century mechanical hegemony. Meanwhile, the human-resistance movement dispatches a lone warrior to safeguard Sarah. Can he stop the virtually indestructible killing machine?"
1138194,Heretic,2024-10-31,/fr96XzlzsONrQrGfdLMiwtQjott.jpg,13.2692,"Two young missionaries are forced to prove their faith when they knock on the wrong door and are greeted by a diabolical Mr. Reed, becoming ensnared in his deadly game of cat-and-mouse."
3933,Corpse Bride,2005-09-12,/isb2Qow76GpqYmsSyfdMfsYAjts.jpg,13.2498,"In a 19th-century European village, a young man about to be married is whisked away to the underworld and wed to a mysterious corpse bride, while his real bride waits bereft in the land of the living."
1249289,Alarum,2025-01-16,/v313aUGmMNj6yNveaiQXysBmjVS.jpg,13.2087,"Two married spies caught in the crosshairs of an international intelligence network will stop at nothing to obtain a critical asset. Joe and Lara are agents living off the grid whose quiet retreat at a winter resort is blown to shreds when members of the old guard suspect the two may have joined an elite team of rogue spies, known as Alarum."
1038392,The Conjuring: Last Rites,2025-09-04,/29ES27icY5CzTcMhlz1H4SdQRod.jpg,13.1985,Paranormal investigators Ed and Lorraine Warren take on one last terrifying case involving mysterious entities they must confront.
1365103,Marriage Unplugged,2024-10-28,/3H99Wl52sBPRqXZ3LJjgODOLfwX.jpg,13.1466,"Unhappy in their marriage, Suzanna and Andrew buy a male sex robot called James, who consequently uncovers the deep fractures in their relationship."
1001435,The Future Awaits,2025-02-26,/j179kr6sLF89MlhTBj0vyNfWBww.jpg,13.1048,"In July 1942, during the Vel’ d’Hiv’ Roundup of Jewish families in Paris, 13 year old Tauba Birenbaum and her parents, who are Polish Jews, find refuge in a tiny room for the next 765 days. Living conditions are tough and they fear being discovered at any moment. But while her parents sink further into despair, Tauba’s fighting spirit shines through. She finds joy in every little thing, from a piano drawn on the floor, to the views of Paris through an open window. Despite extreme circumstances, she will keep hope until the liberation of Paris, and take back control of her life."
801335,Girl in the Basement,2021-02-27,/tPP9n6r5QrIKPnshnJqE7klptj2.jpg,13.0724,"Sara is a teen girl who is looking forward to her 18th birthday to move away from her controlling father Don. But before she could even blow out the candles, Don imprisons her in the basement of their home."
617569,Youngest Aunt,2019-07-18,/soA5MPdfL5SrqSc3UehqxZwpZ85.jpg,15.6832,"Mi-yeong's boyfriend, Joon-cheol, works at a meat restaurant. On the first day, he is shocked by how Mi-yeong's youngest aunt, Seo-yeong, was so young and sexy back in the day. He captures Seo-yeong's attention, as he's so good at his job. Then one day, Seo-yeong and Joon-cheol have a drink after work and Seo-yeong seduces Joon-cheol, who she's been eyeing for a while..."
516729,Paddington in Peru,2024-11-08,/1ffZAucqfvQu36x1C49XfOdjuOG.jpg,12.0427,"Paddington travels to Peru to visit his beloved Aunt Lucy, who now resides at the Home for Retired Bears. With the Brown Family in tow, a thrilling adventure ensues when a mystery plunges them into an unexpected journey through the Amazon rainforest and up to the mountain peaks of Peru."
8681,Taken,2008-02-18,/y5Va1WXDX6nZElVirPrGxf6w99B.jpg,12.4673,"Bryan Mills, a former government operative, is trying to reconnect with his teenage daughter Kim. After reluctantly agreeing with his ex-wife to let Kim go to Paris on vacation with a friend, his worst nightmare comes true. While on the phone with his daughter shortly after she arrives in Paris, she and her friend are abducted by a gang of human traffickers. Working against the clock, Bryan relies on his extensive training and skills to track down the ruthless gang that abducted her and launch a one-man war to rescue his daughter."
49013,Cars 2,2011-06-11,/okIz1HyxeVOMzYwwHUjH2pHi74I.jpg,12.3451,Star race car Lightning McQueen and his pal Mater head overseas to compete in the World Grand Prix race. But the road to the championship becomes rocky as Mater gets caught up in an intriguing adventure of his own: international espionage.
769,GoodFellas,1990-09-12,/aKuFiU82s5ISJpGZp7YkIr3kCUd.jpg,12.6314,"The true story of Henry Hill, a half-Irish, half-Sicilian Brooklyn kid who is adopted by neighbourhood gangsters at an early age and climbs the ranks of a Mafia family under the guidance of Jimmy Conway."
1495,Kingdom of Heaven,2005-05-03,/rNaBe4TwbMef71sgscqabpGKsxh.jpg,12.7128,"After his wife dies, a blacksmith named Balian is thrust into royalty, political intrigue and bloody holy wars during the Crusades."
50620,The Twilight Saga: Breaking Dawn - Part 2,2012-11-13,/7IGdPaKujv0BjI0Zd0m0a4CzEjJ.jpg,12.7097,"After the birth of Renesmee, the Cullens gather other vampire clans in order to protect the child from a false allegation that puts the family in front of the Volturi."
424,Schindler's List,1993-12-15,/sF1U4EUQS8YHUYjNl3pMGNIQyr0.jpg,12.1785,The true story of how businessman Oskar Schindler saved over a thousand Jewish lives from the Nazis while they worked as slaves in his factory during World War II.
118,Charlie and the Chocolate Factory,2005-07-13,/iKP6wg3c6COUe8gYutoGG7qcPnO.jpg,13.0088,"A young boy wins a tour through the most magnificent chocolate factory in the world, led by the world's most unusual candy maker."
646207,The Ice Road,2021-06-24,/pj6UQPrtmC0snzPeU1HUhGWTgz6.jpg,11.9021,"After a remote diamond mine collapses in far northern Canada, an ice road driver must lead an impossible rescue mission over a frozen ocean to save the trapped miners."
454626,Sonic the Hedgehog,2020-02-12,/aQvJ5WPzZgYVDrxLX4R6cLJCEaQ.jpg,12.3976,"Powered with incredible speed, Sonic The Hedgehog embraces his new home on Earth. That is, until Sonic sparks the attention of super-uncool evil genius Dr. Robotnik. Now it’s super-villain vs. super-sonic in an all-out race across the globe to stop Robotnik from using Sonic’s unique power for world domination."
439079,The Nun,2018-09-05,/sFC1ElvoKGdHJIWRpNB3xWJ9lJA.jpg,12.497,A priest with a haunted past and a novice on the threshold of her final vows are sent by the Vatican to investigate the death of a young nun in Romania and confront a malevolent force in the form of a demonic nun.
259693,The Conjuring 2,2016-06-08,/zEqyD0SBt6HL7W9JQoWwtd5Do1T.jpg,12.6118,Lorraine and Ed Warren travel to north London to help a single mother raising four children alone in a house plagued by malicious spirits.
1232449,Young Hearts,2024-10-26,/iGCtYxfuvXfy0BD5m6p7vKuPOxS.jpg,12.8207,"14-year-old Elias increasingly feels like an outsider in his village. When he meets his new neighbour of the same age, Alexander, Elias is confronted with his burgeoning sexuality."
4951,10 Things I Hate About You,1999-03-30,/ujERk3aKABXU3NDXOAxEQYTHe9A.jpg,12.7516,"On the first day at his new school, Cameron instantly falls for Bianca, the gorgeous girl of his dreams. The only problem is that Bianca is forbidden to date until her ill-tempered, completely un-dateable older sister Kat goes out, too. In an attempt to solve his problem, Cameron singles out the only guy who could possibly be a match for Kat: a mysterious bad boy with a nasty reputation of his own."
297802,Aquaman,2018-12-07,/ufl63EFcc5XpByEV2Ecdw6WJZAI.jpg,13.7944,"Half-human, half-Atlantean Arthur Curry is taken on the journey of his lifetime to discover if he is worth of being a king."
1238307,Masameer Junior,2025-06-11,/vjfiq5BG70KiHAEaQ8DdG7bP49M.jpg,12.3352,"After a dire lesson on bad behavior, three unruly six-year-olds embark on a chaotic quest for the ultimate ""good deed"" — unleashing mayhem at every turn."
19912,The Final Destination,2009-08-26,/5vxXrr1MqGsT4NNeRITpfDnl4Rq.jpg,12.7248,A horrifying premonition saves a young man and his friends from death during a racetrack accident but terrible fates await them nonetheless.
1229730,Carjackers,2025-03-27,/wbkPMTz2vVai7Ujyp0ag7AM9SrO.jpg,12.5786,"By day, they're invisible—valets, hostesses, and bartenders at a luxury hotel. By night, they're the Carjackers, a crew of skilled drivers who track and rob wealthy clients on the road. As they plan their ultimate heist, the hotel director hires a ruthless hitman, to stop them at all costs. With danger closing in, can Nora, Zoe, Steve, and Prestance pull off their biggest score yet?"
359724,Ford v Ferrari,2019-11-13,/dR1Ju50iudrOh3YgfwkAU1g2HZe.jpg,12.6019,"American car designer Carroll Shelby and the British-born driver Ken Miles work together to battle corporate interference, the laws of physics, and their own personal demons to build a revolutionary race car for Ford Motor Company and take on the dominating race cars of Enzo Ferrari at the 24 Hours of Le Mans in France in 1966."
1029235,Azrael,2024-09-27,/qpdFKDvJS7oLKTcBLXOaMwUESbs.jpg,12.7352,"In a world where no one speaks, a devout female hunts down a young woman who has escaped her imprisonment. Recaptured by its ruthless leaders, Azrael is due to be sacrificed to pacify an ancient evil deep within the surrounding wilderness."
9286,Final Destination 3,2006-02-09,/p7ARuNKUGPGvkBiDtIDvAzYzonX.jpg,12.7339,"High school senior Wendy's premonition of a deadly rollercoaster ride saves her life and a lucky few, but not from death itself — which seeks out those who escaped their fate."
19912,The Final Destination,2009-08-26,/5vxXrr1MqGsT4NNeRITpfDnl4Rq.jpg,12.7248,A horrifying premonition saves a young man and his friends from death during a racetrack accident but terrible fates await them nonetheless.
1079810,The Long Game,2024-04-12,/inta4LBe5fJsjgsZjCT6nxjSHso.jpg,12.7173,"In a segregated Texas, five Mexican-American teenage caddies were prohibited from playing at the country club where they worked. Against all odds, they formed their own team, built a one-hole course in the fields, and won the 1957 Texas State championship. Based on a true story."
1495,Kingdom of Heaven,2005-05-03,/rNaBe4TwbMef71sgscqabpGKsxh.jpg,12.7128,"After his wife dies, a blacksmith named Balian is thrust into royalty, political intrigue and bloody holy wars during the Crusades."
50620,The Twilight Saga: Breaking Dawn - Part 2,2012-11-13,/7IGdPaKujv0BjI0Zd0m0a4CzEjJ.jpg,12.7097,"After the birth of Renesmee, the Cullens gather other vampire clans in order to protect the child from a false allegation that puts the family in front of the Volturi."
14834,Not Easily Broken,2009-01-09,/8gmdToawg8gaSe9yWZjQ10v7noL.jpg,12.6891,A car accident and shifting affections test the bond between a married couple.
769,GoodFellas,1990-09-12,/aKuFiU82s5ISJpGZp7YkIr3kCUd.jpg,12.6314,"The true story of Henry Hill, a half-Irish, half-Sicilian Brooklyn kid who is adopted by neighbourhood gangsters at an early age and climbs the ranks of a Mafia family under the guidance of Jimmy Conway."
335,Once Upon a Time in the West,1968-12-21,/qbYgqOczabWNn2XKwgMtVrntD6P.jpg,12.6305,"As the railroad builders advance unstoppably through the Arizona desert on their way to the sea, Jill arrives in the small town of Flagstone with the intention of starting a new life."
259693,The Conjuring 2,2016-06-08,/zEqyD0SBt6HL7W9JQoWwtd5Do1T.jpg,12.6118,Lorraine and Ed Warren travel to north London to help a single mother raising four children alone in a house plagued by malicious spirits.
359724,Ford v Ferrari,2019-11-13,/dR1Ju50iudrOh3YgfwkAU1g2HZe.jpg,12.6019,"American car designer Carroll Shelby and the British-born driver Ken Miles work together to battle corporate interference, the laws of physics, and their own personal demons to build a revolutionary race car for Ford Motor Company and take on the dominating race cars of Enzo Ferrari at the 24 Hours of Le Mans in France in 1966."
1229730,Carjackers,2025-03-27,/wbkPMTz2vVai7Ujyp0ag7AM9SrO.jpg,12.5786,"By day, they're invisible—valets, hostesses, and bartenders at a luxury hotel. By night, they're the Carjackers, a crew of skilled drivers who track and rob wealthy clients on the road. As they plan their ultimate heist, the hotel director hires a ruthless hitman, to stop them at all costs. With danger closing in, can Nora, Zoe, Steve, and Prestance pull off their biggest score yet?"
857,Saving Private Ryan,1998-07-24,/uqx37cS8cpHg8U35f9U5IBlrCV3.jpg,12.5696,"As U.S. troops storm the beaches of Normandy, three brothers lie dead on the battlefield, with a fourth trapped behind enemy lines. Ranger captain John Miller and seven men are tasked with penetrating German-held territory and bringing the boy home."
1930,The Amazing Spider-Man,2012-06-23,/jexoNYnPd6vVrmygwF6QZmWPFdu.jpg,12.5445,"Peter Parker is an outcast high schooler abandoned by his parents as a boy, leaving him to be raised by his Uncle Ben and Aunt May. Like most teenagers, Peter is trying to figure out who he is and how he got to be the person he is today. As Peter discovers a mysterious briefcase that belonged to his father, he begins a quest to understand his parents' disappearance – leading him directly to Oscorp and the lab of Dr. Curt Connors, his father's former partner. As Spider-Man is set on a collision course with Connors' alter ego, The Lizard, Peter will make life-altering choices to use his powers and shape his destiny to become a hero."
43421,12,2009-01-01,,12.5325,"After blowing his professional ballet career, John's only way to redeem himself is to concoct the demise of his former partner, Leah, who he blames for his downfall; he rehearses his salvation in his mind in the way that he rehearses a dance, but being able to break from the routine will be the key to his success."
1323784,Bad Influence,2025-01-24,/3xVWCNDAgr01G1Lkjd7F9sAGOc4.jpg,12.5198,An ex-con gets a fresh start when hired to protect a wealthy heiress from a stalker — but their chemistry is hard to resist as they grow closer.
20352,Despicable Me,2010-07-08,/9lOloREsAhBu0pEtU0BgeR1rHyo.jpg,12.5,"Villainous Gru lives up to his reputation as a despicable, deplorable and downright unlikable guy when he hatches a plan to steal the moon from the sky. But he has a tough time staying on task after three orphans land in his care."
1276073,Bullet Train Explosion,2025-04-23,/jmzxlDBwgvRbpPJzNQwizyn9UEn.jpg,12.4972,"When panic erupts on a Tokyo-bound bullet train that will explode if it slows below 100 kph, authorities race against time to save everyone on board."
439079,The Nun,2018-09-05,/sFC1ElvoKGdHJIWRpNB3xWJ9lJA.jpg,12.497,A priest with a haunted past and a novice on the threshold of her final vows are sent by the Vatican to investigate the death of a young nun in Romania and confront a malevolent force in the form of a demonic nun.
974573,Another Simple Favor,2025-03-07,/zboCGZ4aIqPMd7VFI4HWnmc7KYJ.jpg,12.4697,"Stephanie and Emily reunite on the beautiful island of Capri, Italy for Emily's extravagant wedding to a rich Italian businessman. Along with the glamorous guests, expect murder and betrayal to RSVP for a wedding with more twists and turns than the road from the Marina Grande to the Capri town square."
8681,Taken,2008-02-18,/y5Va1WXDX6nZElVirPrGxf6w99B.jpg,12.4673,"Bryan Mills, a former government operative, is trying to reconnect with his teenage daughter Kim. After reluctantly agreeing with his ex-wife to let Kim go to Paris on vacation with a friend, his worst nightmare comes true. While on the phone with his daughter shortly after she arrives in Paris, she and her friend are abducted by a gang of human traffickers. Working against the clock, Bryan relies on his extensive training and skills to track down the ruthless gang that abducted her and launch a one-man war to rescue his daughter."
1272149,Bridget Jones: Mad About the Boy,2025-02-12,/taEVBdVSqYo9YeN3ycw2SosklZL.jpg,12.4644,"Bridget Jones navigates life as a widow and single mum with the help of her family, friends, and former lover, Daniel. Back to work and on the apps, she's pursued by a younger man and maybe – just maybe – her son's science teacher."
799583,The Ministry of Ungentlemanly Warfare,2024-04-18,/8aF0iAKH9MJMYAZdi0Slg77RYa2.jpg,12.4316,"During World War II, the British Army assigns a group of competent soldiers to carry out a mission against the Nazi forces behind enemy lines... A true story about a secret British WWII organization — the Special Operations Executive. Founded by Winston Churchill, their irregular warfare against the Germans helped to change the course of the war, and gave birth to modern black operations."
50619,The Twilight Saga: Breaking Dawn - Part 1,2011-11-16,/qs8LsHKYlVRmJbFUiSUhhRAygwj.jpg,12.4181,Bella Swan and Edward Cullen's honeymoon phase is abruptly disrupted by betrayals and unforeseen tragedies that endanger their world.
585083,Hotel Transylvania: Transformania,2022-01-31,/teCy1egGQa0y8ULJvlrDHQKnxBL.jpg,12.4165,"When Van Helsing's mysterious invention, the ""Monsterfication Ray,"" goes haywire, Drac and his monster pals are all transformed into humans, and Johnny becomes a monster. In their new mismatched bodies, Drac and Johnny must team up and race across the globe to find a cure before it's too late, and before they drive each other crazy."
1225915,Jewel Thief - The Heist Begins,2025-04-24,/eujLbO0kf1eqWC8XpHUJdtAVW2J.jpg,12.4117,"In this high-octane battle of wits and wills, ingenious con artist Rehan devises a diamond heist while trying to outsmart Rajan, his sadistic adversary."
447277,The Little Mermaid,2023-05-18,/ym1dxyOk4jFcSl4Q2zmRrA5BEEN.jpg,12.4051,"The youngest of King Triton’s daughters, and the most defiant, Ariel longs to find out more about the world beyond the sea, and while visiting the surface, falls for the dashing Prince Eric. With mermaids forbidden to interact with humans, Ariel makes a deal with the evil sea witch, Ursula, which gives her a chance to experience life on land, but ultimately places her life – and her father’s crown – in jeopardy."
454626,Sonic the Hedgehog,2020-02-12,/aQvJ5WPzZgYVDrxLX4R6cLJCEaQ.jpg,12.3976,"Powered with incredible speed, Sonic The Hedgehog embraces his new home on Earth. That is, until Sonic sparks the attention of super-uncool evil genius Dr. Robotnik. Now it’s super-villain vs. super-sonic in an all-out race across the globe to stop Robotnik from using Sonic’s unique power for world domination."
995456,Jurassic Greatest Moments: Jurassic Park to Jurassic World,2022-06-04,/tPdsrxdJBBIvJi5rwcnYGUoPAai.jpg,12.3963,"Join the cast of ""Jurassic World Dominion"" as they relive their favorite unforgettable, action-packed and epic moments from the ""Jurassic World"" franchise."
321612,Beauty and the Beast,2017-03-16,/hKegSKIDep2ewJWPUQD7u0KqFIp.jpg,12.3742,A live-action adaptation of Disney's version of the classic tale of a cursed prince and a beautiful young woman who helps him break the spell.
718930,Bullet Train,2022-08-03,/zTgMFlHG5D1EqdQDhfOTAsyzGoX.jpg,12.3638,"Unlucky assassin Ladybug is determined to do his job peacefully after one too many gigs gone off the rails. Fate, however, may have other plans, as Ladybug's latest mission puts him on a collision course with lethal adversaries from around the globe—all with connected, yet conflicting, objectives—on the world's fastest train."
508947,Turning Red,2022-03-10,/qsdjk9oAKSQMWs0Vt5Pyfh6O4GZ.jpg,12.3607,"Thirteen-year-old Mei is experiencing the awkwardness of being a teenager with a twist – when she gets too excited, she transforms into a giant red panda."
49013,Cars 2,2011-06-11,/okIz1HyxeVOMzYwwHUjH2pHi74I.jpg,12.3451,Star race car Lightning McQueen and his pal Mater head overseas to compete in the World Grand Prix race. But the road to the championship becomes rocky as Mater gets caught up in an intriguing adventure of his own: international espionage.
615777,Babylon,2022-12-22,/wjOHjWCUE0YzDiEzKv8AfqHj3ir.jpg,12.3362,"A tale of outsized ambition and outrageous excess, tracing the rise and fall of multiple characters in an era of unbridled decadence and depravity during Hollywood's transition from silent films to sound films in the late 1920s."
1238307,Masameer Junior,2025-06-11,/vjfiq5BG70KiHAEaQ8DdG7bP49M.jpg,12.3352,"After a dire lesson on bad behavior, three unruly six-year-olds embark on a chaotic quest for the ultimate ""good deed"" — unleashing mayhem at every turn."
993710,Back in Action,2025-01-15,/3L3l6LsiLGHkTG4RFB2aBA6BttB.jpg,12.2899,"Fifteen years after vanishing from the CIA to start a family, elite spies Matt and Emily jump back into the world of espionage when their cover is blown."
791373,Zack Snyder's Justice League,2021-03-18,/tnAuB8q5vv7Ax9UAEje5Xi4BXik.jpg,12.269,"Determined to ensure Superman's ultimate sacrifice was not in vain, Bruce Wayne aligns forces with Diana Prince with plans to recruit a team of metahumans to protect the world from an approaching threat of catastrophic proportions."
47971,xXx: Return of Xander Cage,2017-01-13,/hba8zREJpP1AYhaXgb2oJLQeO0K.jpg,12.2666,"Xander Cage is left for dead after an incident, though he secretly returns to action for a new, tough assignment with his handler Augustus Gibbons."
937287,Challengers,2024-04-18,/H6vke7zGiuLsz4v4RPeReb9rsv.jpg,12.2248,"Tennis player turned coach Tashi has taken her husband, Art, and transformed him into a world-famous Major champion. To jolt him out of his recent losing streak, she signs him up for a ""Challenger"" event — close to the lowest level of pro tournament — where he finds himself standing across the net from his former best friend and Tashi's former boyfriend."
