id,title,release_date,poster_path,popularity,overview
122,The Lord of the Rings: The Return of the King,2003-12-17,/rCzpDGLbOoPwLjy3OAm5NUPOTrC.jpg,19.9539,"As armies mass for a final battle that will decide the fate of the world--and powerful, ancient forces of Light and Dark compete to determine the outcome--one member of the Fellowship of the Ring is revealed as the noble heir to the throne of the Kings of Men. Yet, the sole hope for triumph over evil lies with a brave hobbit, Frodo, who, accompanied by his loyal friend Sam and the hideous, wretched Gollum, ventures deep into the very dark heart of Mordor on his seemingly impossible quest to destroy the Ring of Power.​"
481871,Mother's Job,2017-07-27,/oIoJrYsyg34fe66BWndCit1ekUD.jpg,19.9402,"A young man falls in love with his friend's mother.  Hyun-woo, who returned to the military, starts a part-time job at a bar in a difficult situation, where he meets Yoo-sun, a woman who captures the hearts of customers with her skillful ways. Then one day, Hyun-woo, who was alone with her, finds himself in a shock with his friends Min-seok and Yoo-sun. When Hyun-woo confesses the truth after a hard time, Yoo-sun asks her to keep her relationship secret. Hyun-woo, who failed to reject Min-seok's proposal to live in his own home, begins a breathtaking cohabitation with Yoo-sun."
674,Harry Potter and the Goblet of Fire,2005-11-16,/fECBtHlr0RB3foNHDiCBXeg9Bv9.jpg,19.9288,"When Harry Potter's name emerges from the Goblet of Fire, he becomes a competitor in a grueling battle for glory among three wizarding schools—the Triwizard Tournament. But since Harry never submitted his name for the Tournament, who did? Now Harry must confront a deadly dragon, fierce water demons and an enchanted maze only to find himself in the cruel grasp of He Who Must Not Be Named."
1180648,Mudbrick,2024-10-10,/paVJNyxq5odaAHC9YlmNUlceQpu.jpg,19.844,"After inheriting an old mudbrick house in his home village in Eastern Europe, a man returns after spending his whole life in England, only to find out that inhabitants are hiding a dark secret about the pagan Slavic cult and his own past."
977294,Tin Soldier,2025-05-22,/lFFDrFLXywFhy6khHes1LCFVMsL.jpg,19.8282,"An ex-special forces operative seeks revenge against a cult leader who has corrupted his former comrades, the Shinjas. This leader, known as The Bokushi, promises veterans a purpose and protection, but is revealed to be a destructive influence. The ex-soldier, Nash Cavanaugh, joins forces with military operative Emmanuel Ashburn to infiltrate the Bokushi's fortress and expose his reign of terror"
146233,Prisoners,2013-09-19,/uhviyknTT5cEQXbn6vWIqfM4vGm.jpg,19.8119,"Keller Dover is facing every parent’s worst nightmare. His six-year-old daughter, Anna, is missing, together with her young friend, Joy, and as minutes turn to hours, panic sets in. The only lead is a dilapidated RV that had earlier been parked on their street."
1726,Iron Man,2008-04-30,/78lPtwv72eTNqFW9COBYI0dWDJa.jpg,19.7901,"After being held captive in an Afghan cave, billionaire engineer Tony Stark creates a unique weaponized suit of armor to fight evil."
862,Toy Story,1995-11-22,/uXDfjJbdP4ijW5hWSBrPrlKpxab.jpg,19.7804,"Led by Woody, Andy's toys live happily in his room until Andy's birthday brings Buzz Lightyear onto the scene. Afraid of losing his place in Andy's heart, Woody plots against Buzz. But when circumstances separate Buzz and Woody from their owner, the duo eventually learns to put aside their differences."
936108,Smurfs,2025-06-30,/8o6lkhL32xQJeB52IIG1us5BVey.jpg,19.7785,"When Papa Smurf is mysteriously taken by evil wizards, Razamel and Gargamel, Smurfette leads the Smurfs on a mission into the real world to save him. With the help of new friends, the Smurfs must discover what defines their destiny to save the universe."
550,Fight Club,1999-10-15,/jSziioSwPVrOy9Yow3XhWIBDjq1.jpg,19.7206,"A ticking-time-bomb insomniac and a slippery soap salesman channel primal male aggression into a shocking new form of therapy. Their concept catches on, with underground ""fight clubs"" forming in every town, until an eccentric gets in the way and ignites an out-of-control spiral toward oblivion."
324552,John Wick: Chapter 2,2017-02-08,/hXWBc0ioZP3cN4zCu6SN3YHXZVO.jpg,19.6325,"John Wick is forced out of retirement by a former associate looking to seize control of a shadowy international assassins’ guild. Bound by a blood oath to aid him, Wick travels to Rome and does battle against some of the world’s most dangerous killers."
823464,Godzilla x Kong: The New Empire,2024-03-27,/z1p34vh7dEOnLDmyCrlUVLuoDzd.jpg,19.6263,"Following their explosive showdown, Godzilla and Kong must reunite against a colossal undiscovered threat hidden within our world, challenging their very existence – and our own."
209112,Batman v Superman: Dawn of Justice,2016-03-23,/5UsK3grJvtQrtzEgqNlDljJW96w.jpg,19.4665,"Fearing the actions of a god-like Super Hero left unchecked, Gotham City’s own formidable, forceful vigilante takes on Metropolis’s most revered, modern-day savior, while the world wrestles with what sort of hero it really needs. And with Batman and Superman at war with one another, a new threat quickly arises, putting mankind in greater danger than it’s ever known before."
1396122,Taandob,2025-06-07,/iplMLlXU1BgmTz4xviILTOlECYL.jpg,19.4592,"A young man named Swadhin moves to Dhaka after failing to secure 22 jobs. Pressured by his fiancée’s family, he has two months to find work. His journey takes a dark turn when he’s mistakenly detained, exposing him to systemic injustice and political unrest."
1118031,Apocalypse Z: The Beginning of the End,2024-10-04,/wIGJnIFQlESkC2rLpfA8EDHqk4g.jpg,19.418,"When a kind of rabies that transforms people into aggressive creatures spreads across the planet, Manel isolates himself at home with his cat, relying on his wits to survive; but soon they must go out in search of food, by land and by sea, dodging many dangers."
1359977,Conjuring the Cult,2024-10-01,/t4MiAeYpjL7saYvqvcn9xtOfA4K.jpg,19.3625,"After discovering his blood-soaked daughter dead in the bathtub, David Bryson attends a self-help group to help save him from his ghostly nightmares. But when a group of mysterious cult-like women offer to help him resurrect his daughter. David's choices will not just decide his fate... but the fate of his dead daughter's SOUL."
109445,Frozen,2013-11-20,/mbPrrbt8bSLcHSBCHnRclPlMZPl.jpg,19.3543,"Young princess Anna of Arendelle dreams about finding true love at her sister Elsa’s coronation. Fate takes her on a dangerous journey in an attempt to end the eternal winter that has fallen over the kingdom. She's accompanied by ice delivery man Kristoff, his reindeer Sven, and snowman Olaf. On an adventure where she will find out what friendship, courage, family, and true love really means."
49521,Man of Steel,2013-06-12,/8GFtkImmK0K1VaUChR0n9O61CFU.jpg,19.3058,"A young boy learns that he has extraordinary powers and is not of this earth. As a young man, he journeys to discover where he came from and what he was sent here to do. But the hero in him must emerge if he is to save the world from annihilation and become the symbol of hope for all mankind."
375834,"It's Called 'Murder', Baby",1983-06-15,/3t0AGedAVSiVOu8614okkVRyU1i.jpg,19.2705,"In 1940s Los Angeles, private investigator Nick Popodopolis, is hired by actress Dixie Ray, to find her blackmailer.  Edited R version of adult film, Dixie Ray Hollywood Star."
674,Harry Potter and the Goblet of Fire,2005-11-16,/fECBtHlr0RB3foNHDiCBXeg9Bv9.jpg,19.9288,"When Harry Potter's name emerges from the Goblet of Fire, he becomes a competitor in a grueling battle for glory among three wizarding schools—the Triwizard Tournament. But since Harry never submitted his name for the Tournament, who did? Now Harry must confront a deadly dragon, fierce water demons and an enchanted maze only to find himself in the cruel grasp of He Who Must Not Be Named."
977294,Tin Soldier,2025-05-22,/lFFDrFLXywFhy6khHes1LCFVMsL.jpg,19.8282,"An ex-special forces operative seeks revenge against a cult leader who has corrupted his former comrades, the Shinjas. This leader, known as The Bokushi, promises veterans a purpose and protection, but is revealed to be a destructive influence. The ex-soldier, Nash Cavanaugh, joins forces with military operative Emmanuel Ashburn to infiltrate the Bokushi's fortress and expose his reign of terror"
863,Toy Story 2,1999-10-30,/yFWQkz2ynjwsazT6xQiIXEUsyuh.jpg,20.2179,"Andy heads off to Cowboy Camp, leaving his toys to their own devices. Things shift into high gear when an obsessive toy collector named Al McWhiggen, owner of Al's Toy Barn kidnaps Woody. Andy's toys mount a daring rescue mission, Buzz Lightyear meets his match and Woody has to decide where he and his heart truly belong."
1098378,Your Monster,2024-10-25,/nHlHRntqfDM0ORsfgPL28u4GiTT.jpg,17.3613,"After her life falls apart, soft-spoken actress Laura Franco finds her voice again when she meets a terrifying, yet weirdly charming, monster living in her closet."
927342,Amaran,2024-10-31,/eCB06m1KUGilEOlIzb40nkQhVY0.jpg,17.2144,"A heroic true story of Major Mukund Varadarajan, an Indian Army officer who displayed extraordinary bravery during a counterterrorism mission in Kashmir’s Shopian district. The film captures his courage in protecting his nation and the devotion of his wife Indhu Rebecaa Varghese."
1118031,Apocalypse Z: The Beginning of the End,2024-10-04,/wIGJnIFQlESkC2rLpfA8EDHqk4g.jpg,19.418,"When a kind of rabies that transforms people into aggressive creatures spreads across the planet, Manel isolates himself at home with his cat, relying on his wits to survive; but soon they must go out in search of food, by land and by sea, dodging many dangers."
1244944,The Woman in the Yard,2025-03-27,/n0WS2TsNcS6dtaZKzxipyO7LuCJ.jpg,17.8388,"In the aftermath of her husband's death, widow Ramona's struggle to raise her two kids is hindered by the arrival of a mysterious woman with supernatural abilities."
676685,Panda Bear in Africa,2024-03-15,/wxpu7svVqA0ALYpofQBPujGelN3.jpg,18.5205,"A young adventurous panda travels from China to Africa to rescue his best friend, Jielong the Dragon, who has been kidnapped. On his journey, he discovers a strange amazing new world of mountains, deserts and jungles."
228150,Fury,2014-10-15,/pfte7wdMobMF4CVHuOxyu6oqeeA.jpg,20.4565,"In the last months of World War II, as the Allies make their final push in the European theatre, a battle-hardened U.S. Army sergeant named 'Wardaddy' commands a Sherman tank called 'Fury' and its five-man crew on a deadly mission behind enemy lines. Outnumbered and outgunned, Wardaddy and his men face overwhelming odds in their heroic attempts to strike at the heart of Nazi Germany."
1147416,"Miraculous World: London, At the Edge of Time",2024-11-14,/6AtoMpHvs9pxd30KsyK8QmJ9W9M.jpg,18.286,"To save the future from a terrible fate, Marinette becomes Chronobug and teams up with Bunnyx to defeat a mysterious opponent who travels through time. Who is this new supervillain, and why are they obsessed with exposing Marinette's secret superhero identity? Marinette's only hope is to defeat her new opponent to prevent the end of Ladybug and time itself!"
680,Pulp Fiction,1994-09-10,/vQWk5YBFWF4bZaofAbv0tShwBvQ.jpg,17.4813,"A burger-loving hit man, his philosophical partner, a drug-addled gangster's moll and a washed-up boxer converge in this sprawling, comedic crime caper. Their adventures unfurl in three stories that ingeniously trip back and forth in time."
698687,Transformers One,2024-09-11,/iRCgqpdVE4wyLQvGYU3ZP7pAtUc.jpg,18.261,"The untold origin story of Optimus Prime and Megatron, better known as sworn enemies, but once were friends bonded like brothers who changed the fate of Cybertron forever."
1100782,Smile 2,2024-10-16,/ht8Uv9QPv9y7K0RvUyJIaXOZTfd.jpg,18.3396,"About to embark on a new world tour, global pop sensation Skye Riley begins experiencing increasingly terrifying and inexplicable events. Overwhelmed by the escalating horrors and the pressures of fame, Skye is forced to face her dark past to regain control of her life before it spirals out of control."
1356236,Saint Catherine,2024-09-24,/hBJdzKPeDaC96AzlrtMWBomYSZV.jpg,17.5909,An orphaned girl is rescued from a satanic ritual and taken to Saint Catherine Institute for homeless youth. There she will learn new skills while facing demons that stalk her.
1045938,G20,2025-04-10,/wv6oWAleCJZUk5htrGg413t3GCy.jpg,17.8391,"After the G20 Summit is overtaken by terrorists, President Danielle Sutton must bring all her statecraft and military experience to defend her family and her fellow leaders."
38365,Grown Ups,2010-06-24,/ys0LscDFAuZxfUcpH5moiPeFfXs.jpg,18.202,"After their high school basketball coach passes away, five good friends and former teammates reunite for a Fourth of July holiday weekend."
1144430,Last Bullet,2025-05-06,/qycPITRqXgPai7zj1gKffjCdSB5.jpg,17.6682,Car genius Lino returns to conclude his vendetta against Areski and the corrupt commander who ruined their lives in this turbo-charged trilogy finale.
739187,12,2020-09-04,/kCnwPVGf7zHW2iLSgbvKDLl8m4Q.jpg,18.3085,not there yet
209112,Batman v Superman: Dawn of Justice,2016-03-23,/5UsK3grJvtQrtzEgqNlDljJW96w.jpg,19.4665,"Fearing the actions of a god-like Super Hero left unchecked, Gotham City’s own formidable, forceful vigilante takes on Metropolis’s most revered, modern-day savior, while the world wrestles with what sort of hero it really needs. And with Batman and Superman at war with one another, a new threat quickly arises, putting mankind in greater danger than it’s ever known before."
12444,Harry Potter and the Deathly Hallows: Part 1,2010-11-17,/iGoXIpQb7Pot00EEdwpwPajheZ5.jpg,17.8491,"Harry, Ron and Hermione walk away from their last year at Hogwarts to find and destroy the remaining Horcruxes, putting an end to Voldemort's bid for immortality. But with Harry's beloved Dumbledore dead and Voldemort's unscrupulous Death Eaters on the loose, the world is more dangerous than ever."
12444,Harry Potter and the Deathly Hallows: Part 1,2010-11-17,/iGoXIpQb7Pot00EEdwpwPajheZ5.jpg,17.8491,"Harry, Ron and Hermione walk away from their last year at Hogwarts to find and destroy the remaining Horcruxes, putting an end to Voldemort's bid for immortality. But with Harry's beloved Dumbledore dead and Voldemort's unscrupulous Death Eaters on the loose, the world is more dangerous than ever."
429,"The Good, the Bad and the Ugly",1966-12-22,/bX2xnavhMYjWDoZp1VM6VnU1xwe.jpg,17.8326,"While the Civil War rages on between the Union and the Confederacy, three men – a quiet loner, a ruthless hitman, and a Mexican bandit – comb the American Southwest in search of a strongbox containing $200,000 in stolen gold."
710258,Rust,2025-05-01,/tbJ3RkA2s6X5qrBzrYHYTxvDBui.jpg,17.0161,"Infamous outlaw Harland Rust breaks his estranged grandson Lucas out of prison, after Lucas is convicted to hang for an accidental murder. The two must outrun legendary U.S Marshal Wood Helm and bounty hunter Fenton ""Preacher"" Lang who are hot on their tails. Deeply buried secrets rise from the ashes and an unexpected familial bond begins to form as the mismatched duo tries to survive the merciless American Frontier."
748783,The Garfield Movie,2024-04-30,/xYduFGuch9OwbCOEUiamml18ZoB.jpg,21.2149,"Garfield, the world-famous, Monday-hating, lasagna-loving indoor cat, is about to have a wild outdoor adventure! After an unexpected reunion with his long-lost father – scruffy street cat Vic – Garfield and his canine friend Odie are forced from their perfectly pampered life into joining Vic in a hilarious, high-stakes heist."
1267217,Sugar Baby,2024-04-25,/kcREsnVDEFFXmt5GuPwyGqyDuDJ.jpg,16.2266,"Love comes without asking. Often not to those, not so and not then. Can a genuine feeling survive when everything started wrong and the whole world is against it? Give up everything or give up? Burn or survive?"
1365103,Marriage Unplugged,2024-10-28,/3H99Wl52sBPRqXZ3LJjgODOLfwX.jpg,13.1466,"Unhappy in their marriage, Suzanna and Andrew buy a male sex robot called James, who consequently uncovers the deep fractures in their relationship."
585,"Monsters, Inc.",2001-11-01,/wFSpyMsp7H0ttERbxY7Trlv8xry.jpg,17.7558,"Lovable Sulley and his wisecracking sidekick Mike Wazowski are the top scare team at Monsters, Inc., the scream-processing factory in Monstropolis. When a little girl named Boo wanders into their world, it's the monsters who are scared silly, and it's up to Sulley and Mike to keep her out of sight and get her back home."
635302,Demon Slayer -Kimetsu no Yaiba- The Movie: Mugen Train,2020-10-16,/h8Rb9gBr48ODIwYUttZNYeMWeUU.jpg,17.2103,"Tanjiro Kamado, joined with Inosuke Hashibira, a boy raised by boars who wears a boar's head, and Zenitsu Agatsuma, a scared boy who reveals his true power when he sleeps, boards the Infinity Train on a new mission with the Fire Hashira, Kyojuro Rengoku, to defeat a demon who has been tormenting the people and killing the demon slayers who oppose it!"
11,Star Wars,1977-05-25,/6FfCtAuVAW8XJjZ7eWeLibRLWTw.jpg,18.297,Princess Leia is captured and held hostage by the evil Imperial forces in their effort to take over the galactic Empire. Venturesome Luke Skywalker and dashing captain Han Solo team together with the loveable robot duo R2-D2 and C-3PO to rescue the beautiful princess and restore peace and justice in the Empire.
11324,Shutter Island,2010-02-14,/nrmXQ0zcZUL8jFLrakWc90IR8z9.jpg,17.6825,"World War II soldier-turned-U.S. Marshal Teddy Daniels investigates the disappearance of a patient from a hospital for the criminally insane, but his efforts are compromised by troubling visions and a mysterious doctor."
121,The Lord of the Rings: The Two Towers,2002-12-18,/5VTN0pR8gcqV3EPUHHfMGnJYN9L.jpg,17.8677,"Frodo Baggins and the other members of the Fellowship continue on their sacred quest to destroy the One Ring--but on separate paths. Their destinies lie at two towers--Orthanc Tower in Isengard, where the corrupt wizard Saruman awaits, and Sauron's fortress at Barad-dur, deep within the dark lands of Mordor. Frodo and Sam are trekking to Mordor to destroy the One Ring of Power while Gimli, Legolas and Aragorn search for the orc-captured Merry and Pippin. All along, nefarious wizard Saruman awaits the Fellowship members at the Orthanc Tower in Isengard."
2062,Ratatouille,2007-06-28,/t3vaWRPSf6WjDSamIkKDs1iQWna.jpg,18.1944,"Remy, a resident of Paris, appreciates good food and has quite a sophisticated palate. He would love to become a chef so he can create and enjoy culinary masterpieces to his heart's delight. The only problem is, Remy is a rat. When he winds up in the sewer beneath one of Paris' finest restaurants, the rodent gourmet finds himself ideally placed to realize his dream."
9532,Final Destination,2000-03-17,/1mXhlQMnlfvJ2frxTjZSQNnA9Vp.jpg,16.1827,"After a teenager has a terrifying vision of him and his friends dying in a plane crash, he prevents the accident only to have Death hunt them down, one by one."
675,Harry Potter and the Order of the Phoenix,2007-07-08,/5aOyriWkPec0zUDxmHFP9qMmBaj.jpg,17.7035,"Returning for his fifth year of study at Hogwarts, Harry is stunned to find that his warnings about the return of Lord Voldemort have been ignored. Left with no choice, Harry takes matters into his own hands, training a small group of students to defend themselves against the dark arts."
1092073,The Haunting at Saint Joseph's,2023-02-26,/eDzQFxs0KTzHUPkIR0c44TSGJUR.jpg,16.8959,"An engaged Muslim doctor, her fiancé, and their friends go on a holiday at St. Joseph’s Guesthouse, unaware that it was the site of a sacrifice of an innocent centuries before. They soon come to believe that it's haunted and causing them to go crazy, as their emotions spiral out of control."
337167,Fifty Shades Freed,2018-01-17,/jjPJ4s3DWZZvI4vw8Xfi4Vqa1Q8.jpg,17.391,"Believing they have left behind shadowy figures from their past, newlyweds Christian and Ana fully embrace an inextricable connection and shared life of luxury. But just as she steps into her role as Mrs. Grey and he relaxes into an unfamiliar stability, new threats could jeopardize their happy ending before it even begins."
968171,Sex Education Mistresses,1973-11-20,/xghWMg0pkBOdLHCTESyeyHU68wl.jpg,26.9498,"An erotic comedy depicting the sex adventures of  young wives living in an apartment complex, that are not satisfied with just having sex with their husbands."
462183,Wild Awakening,2016-10-23,/jD9MILmkIeBBoFJbOjHAaCQ3sEA.jpg,16.2832,"Toni and Emma are brother and sister who owns a stable farm. Ramon and his son, Aaron works for them. Toni is openly gay and loves to party, Emma has a crush on Aaron who is a closeted gay who is afraid that his father might find out, but his father also has a secret."
976573,Elemental,2023-06-14,/4Y1WNkd88JXmGfhtWR7dmDAo1T2.jpg,16.6349,"In a city where fire, water, land and air residents live together, a fiery young woman and a go-with-the-flow guy will discover something elemental: how much they have in common."
767,Harry Potter and the Half-Blood Prince,2009-07-15,/z7uo9zmQdQwU5ZJHFpv2Upl30i1.jpg,17.4202,"As Lord Voldemort tightens his grip on both the Muggle and wizarding worlds, Hogwarts is no longer a safe haven. Harry suspects perils may even lie within the castle, but Dumbledore is more intent upon preparing him for the final battle fast approaching. Together they work to find the key to unlock Voldemorts defenses and to this end, Dumbledore recruits his old friend and colleague Horace Slughorn, whom he believes holds crucial information. Even as the decisive showdown looms, romance blossoms for Harry, Ron, Hermione and their classmates. Love is in the air, but danger lies ahead and Hogwarts may never be the same again."
315162,Puss in Boots: The Last Wish,2022-12-07,/aV1KGO9X3S4kzqEptVDAvGjccql.jpg,17.3151,"Puss in Boots discovers that his passion for adventure has taken its toll: He has burned through eight of his nine lives, leaving him with only one life left. Puss sets out on an epic journey to find the mythical Last Wish and restore his nine lives."
82023,Hotel Desire,2011-12-07,/myzQj8Rk178DrWsiZjVKjz7Kj9P.jpg,16.8448,"Antonia is a single mother who works as a hotel maid in Berlin. A normal hot summer day takes a dramatic turn when she crosses paths with a particular guest of the hotel, famous blind portrait painter Julius Pass."
936108,Smurfs,2025-06-30,/8o6lkhL32xQJeB52IIG1us5BVey.jpg,19.7785,"When Papa Smurf is mysteriously taken by evil wizards, Razamel and Gargamel, Smurfette leads the Smurfs on a mission into the real world to save him. With the help of new friends, the Smurfs must discover what defines their destiny to save the universe."
744,Top Gun,1986-05-16,/xUuHj3CgmZQ9P2cMaqQs4J0d4Zc.jpg,16.6937,"For Lieutenant Pete 'Maverick' Mitchell and his friend and co-pilot Nick 'Goose' Bradshaw, being accepted into an elite training school for fighter pilots is a dream come true. But a tragedy, as well as personal demons, will threaten Pete's dreams of becoming an ace pilot."
667538,Transformers: Rise of the Beasts,2023-06-06,/gPbM0MK8CP8A174rmUwGsADNYKD.jpg,16.6644,"When a new threat capable of destroying the entire planet emerges, Optimus Prime and the Autobots must team up with a powerful faction known as the Maximals. With the fate of humanity hanging in the balance, humans Noah and Elena will do whatever it takes to help the Transformers as they engage in the ultimate battle to save Earth."
296096,Me Before You,2016-06-01,/Ia3dzj5LnCj1ZBdlVeJrbKJQxG.jpg,17.7117,"A small town girl is caught between dead-end jobs. A high-profile, successful man becomes wheelchair bound following an accident. The man decides his life is not worth living until the girl is hired for six months to be his new caretaker. Worlds apart and trapped together by circumstance, the two get off to a rocky start. But the girl becomes determined to prove to the man that life is worth living and as they embark on a series of adventures together, each finds their world changing in ways neither of them could begin to imagine."
354526,Serena the Sexplorer,2013-03-03,/fYXtxAJBBnxpPMCzJyEfLGqzFfe.jpg,27.3517,"Lusty, luscious interstellar visitor Serena comes to Earth to satisfy her deepest desires in this erotic tale."
285,Pirates of the Caribbean: At World's End,2007-05-19,/jGWpG4YhpQwVmjyHEGkxEkeRf0S.jpg,16.8188,"Will Turner and Elizabeth Swann join forces with the revived Captain Barbossa to free Jack Sparrow from Davy Jones' locker. The group must navigate dangerous waters, confront many foes and, ultimately, choose sides in a battle wherein piracy itself hangs in the balance."
335984,Blade Runner 2049,2017-10-04,/gajva2L0rPYkEWjzgFlBXCAVBE5.jpg,17.8466,"Thirty years after the events of the first film, a new blade runner, LAPD Officer K, unearths a long-buried secret that has the potential to plunge what's left of society into chaos. K's discovery leads him on a quest to find Rick Deckard, a former LAPD blade runner who has been missing for 30 years."
557,Spider-Man,2002-05-01,/gh4cZbhZxyTbgxQPxD0dOudNPTn.jpg,16.9473,"After being bitten by a genetically altered spider at Oscorp, nerdy but endearing high school student Peter Parker is endowed with amazing powers to become the superhero known as Spider-Man."
10138,Iron Man 2,2010-04-28,/6WBeq4fCfn7AN0o21W9qNcRF2l9.jpg,17.8362,"With the world now aware of his dual life as the armored superhero Iron Man, billionaire inventor Tony Stark faces pressure from the government, the press and the public to share his technology with the military. Unwilling to let go of his invention, Stark, with Pepper Potts and James 'Rhodey' Rhodes at his side, must forge new alliances – and confront powerful enemies."
