id,title,release_date,poster_path,popularity,overview
846422,The Old Guard 2,2025-07-01,/wqfu3bPLJaEWJVk3QOm0rKhxf1A.jpg,617.5863,Andy and her team of immortal warriors fight with renewed purpose as they face a powerful new foe threatening their mission to protect humanity.
541671,Ballerina,2025-06-04,/2VUmvqsHb6cEtdfscEA6fqqVzLg.jpg,594.0901,"Taking place during the events of John Wick: Chapter 3 – Parabellum, Eve Macarro begins her training in the assassin traditions of the Ruska Roma."
749170,Heads of State,2025-07-02,/lVgE5oLzf7ABmzyASEVcjYyHI41.jpg,514.58,"The UK Prime Minister and US President have a public rivalry that risks their countries' alliance. But when they become targets of a powerful enemy, they're forced to rely on each other as they go on a wild, multinational run. Allied with Noel, a brilliant MI6 agent, they must find a way to thwart a conspiracy that threatens the free world."
1011477,Karate Kid: Legends,2025-05-08,/AEgggzRr1vZCLY86MAp93li43z.jpg,532.1165,"After a family tragedy, kung fu prodigy Li Fong is uprooted from his home in Beijing and forced to move to New York City with his mother. When a new friend needs his help, Li enters a karate competition – but his skills alone aren't enough. Li's kung fu teacher Mr. Han enlists original Karate Kid Daniel LaRusso for help, and Li learns a new way to fight, merging their two styles into one for the ultimate martial arts showdown."
1119878,Ice Road: Vengeance,2025-06-27,/2vHQBX5L4yoExTa55KmGIg2Q5s3.jpg,521.0194,"Big rig ice road driver Mike McCann travels to Nepal to scatter his late brother’s ashes on Mt. Everest. While on a packed tour bus traversing the deadly 12,000 ft. terrain of the infamous Road to the Sky, McCann and his mountain guide encounter a group of mercenaries and must fight to save themselves, the busload of innocent travelers, and the local villagers’ homeland."
986056,Thunderbolts*,2025-04-30,/hqcexYHbiTBfDIdDWxrxPtVndBX.jpg,427.1211,"After finding themselves ensnared in a death trap, seven disillusioned castoffs must embark on a dangerous mission that will force them to confront the darkest corners of their pasts."
1234821,Jurassic World Rebirth,2025-07-01,/q0fGCmjLu42MPlSO9OYWpI5w86I.jpg,387.6663,"Five years after the events of Jurassic World Dominion, covert operations expert Zora Bennett is contracted to lead a skilled team on a top-secret mission to secure genetic material from the world's three most massive dinosaurs. When Zora's operation intersects with a civilian family whose boating expedition was capsized, they all find themselves stranded on an island where they come face-to-face with a sinister, shocking discovery that's been hidden from the world for decades."
574475,Final Destination Bloodlines,2025-05-14,/6WxhEvFsauuACfv8HyoVX6mZKFj.jpg,256.4563,"Plagued by a violent recurring nightmare, college student Stefanie heads home to track down the one person who might be able to break the cycle and save her family from the grisly demise that inevitably awaits them all."
1151031,Bring Her Back,2025-05-28,/tObSf1VzzHt9xB0csanFtb3DRjf.jpg,223.8848,"Following the death of their father, a brother and sister are introduced to their new sibling by their foster mother, only to learn that she has a terrifying secret."
1287536,Dora and the Search for Sol Dorado,2025-07-02,/r3d6u2n7iPoWNsSWwlJJWrDblOH.jpg,239.0733,"Dora, Diego, and their new friends trek through the perilous dangers of the Amazonian jungle in search of the ancient and powerful treasure of Sol Dorado to keep it out of enemy hands."
1061474,Superman,2025-07-09,/ombsmhYUqR4qqOLOxAyr5V8hbyv.jpg,226.9138,"Superman, a journalist in Metropolis, embarks on a journey to reconcile his Kryptonian heritage with his human upbringing as Clark Kent."
552524,Lilo & Stitch,2025-05-17,/tUae3mefrDVTgm5mRzqWnZK6fOP.jpg,224.4734,The wildly funny and touching story of a lonely Hawaiian girl and the fugitive alien who helps to mend her broken family.
803796,KPop Demon Hunters,2025-06-20,/43c1efKzA1kigNzY0HBzeoXp8LR.jpg,214.7625,"When K-pop superstars Rumi, Mira and Zoey aren't selling out stadiums, they're using their secret powers to protect their fans from supernatural threats."
1246369,Muromachi Burai,2025-01-17,/6U0i0HsSCvhRW4IpGzdead6QRo3.jpg,192.1538,"Set in war-torn 15th century Kyoto, on the eve of the Onin War, the movie centers on a band of outlaws led by Hyoe (Oizumi) a scoundrel whose lethal sword skills place him at the tip of the spear in a deadly uprising against the corrupt Shogunate and its army, led by former friend-turned-archrival, Doken (Tsutsumi)."
1278950,The Ritual,2025-04-18,/ktqPs5QyuF8SpKnipvVHb3fwD8d.jpg,170.0829,"Two priests, one in crisis with his faith and the other confronting a turbulent past, must overcome their differences to perform a risky exorcism."
1087192,How to Train Your Dragon,2025-06-06,/3lwlJL8aW6Wor9tKvME8VoMnBkn.jpg,181.5258,"On the rugged isle of Berk, where Vikings and dragons have been bitter enemies for generations, Hiccup stands apart, defying centuries of tradition when he befriends Toothless, a feared Night Fury dragon. Their unlikely bond reveals the true nature of dragons, challenging the very foundations of Viking society."
911430,F1,2025-06-25,/vqBmyAj0Xm9LnS1xe1MSlMAJyHq.jpg,179.2995,Racing legend Sonny Hayes is coaxed out of retirement to lead a struggling Formula 1 team—and mentor a young hotshot driver—while chasing one more chance at glory.
1233413,Sinners,2025-04-16,/yqsCU5XOP2mkbFamzAqbqntmfav.jpg,132.8717,"Trying to leave their troubled lives behind, twin brothers return to their hometown to start again, only to discover that an even greater evil is waiting to welcome them back."
7451,xXx,2002-08-09,/xeEw3eLeSFmJgXZzmF2Efww0q3s.jpg,123.3259,"Xander Cage is your standard adrenaline junkie with no fear and a lousy attitude. When the US Government ""recruits"" him to go on a mission, he's not exactly thrilled. His mission: to gather information on an organization that may just be planning the destruction of the world, led by the nihilistic Yorgi."
605722,Long Distance,2024-07-12,/m5NKltgQqqyoWJNuK18IqEGRG7J.jpg,111.9343,"After crash-landing on an alien planet, an asteroid miner must contend with the challenges of his new surroundings, while making his way across the harsh terrain to the only other survivor – a woman who is trapped in her escape pod."
950387,A Minecraft Movie,2025-03-31,/yFHHfHcUgGAxziP1C3lLt0q2T4s.jpg,109.5701,"Four misfits find themselves struggling with ordinary problems when they are suddenly pulled through a mysterious portal into the Overworld: a bizarre, cubic wonderland that thrives on imagination. To get back home, they'll have to master this world while embarking on a magical quest with an unexpected, expert crafter, Steve."
575265,Mission: Impossible - The Final Reckoning,2025-05-17,/z53D72EAOxGRqdr7KXXWp9dJiDe.jpg,102.8022,"Ethan Hunt and team continue their search for the terrifying AI known as the Entity — which has infiltrated intelligence networks all over the globe — with the world's governments and a mysterious ghost from Hunt's past on their trail. Joined by new allies and armed with the means to shut the Entity down for good, Hunt is in a race against time to prevent the world as we know it from changing forever."
1100988,28 Years Later,2025-06-18,/wnHUip9oKvDJEJUEk62L4rFSYGa.jpg,102.5134,"Twenty-eight years since the rage virus escaped a biological weapons laboratory, now, still in a ruthlessly enforced quarantine, some have found ways to exist amidst the infected. One such group lives on a small island connected to the mainland by a single, heavily-defended causeway. When one member departs on a mission into the dark heart of the mainland, he discovers secrets, wonders, and horrors that have mutated not only the infected but other survivors as well."
1429744,Ziam,2025-07-08,/yHYj2t3NzsjkHVYa0bPri4sMBsg.jpg,100.7696,"In a fight for survival against a horrifying army of zombies, a former Muay Thai fighter must use skill, speed and grit to save his girlfriend."
1311844,The Twisters,2024-06-28,/9xjSHm0R9tII8JCWHS1VdbftFk1.jpg,99.8635,"A deadly patchwork of destructive cyclones is on an apocalyptic path of convergence at a populated Midwest city center. There, the twisters will merge into one mega tornado that threatens to obliterate the cities for hundreds of miles around."
1442776,Crazy Lizard,2024-03-27,/9TFaFsSXedaALXTzba349euDeoY.jpg,98.4106,"A young man climbs into the mountains to pick up a meteorite that has fallen there and is killed by something. The ""thing"" descends to the village and begins to eat the inhabitants one by one, terrorizing the entire island."
1127110,Diablo,2025-06-13,/uFQduVyYIinJy3eLjozgfl6Xtcn.jpg,94.4175,"Ex-con Kris Chaney seizes the daughter of a Colombian gangster to fulfill a noble promise to the young girl's mother. When her father enlists both the criminal underworld and a psychotic killer to exact his revenge, Kris relies on everything he's ever learned to stay alive and keep his word."
1090007,First Shift,2024-08-30,/ajsGI4JYaciPIe3gPgiJ3Vw5Vre.jpg,91.326,"NYPD veteran Mike and rookie Angela tackle a high-stakes day on New York's toughest streets, diving headfirst into a vortex of danger and action. Their adrenaline-fueled pursuits and unexpected threats unfold as they navigate perilous encounters. Amidst the chaos, intense challenges forge unbreakable bonds."
1087891,The Amateur,2025-04-09,/SNEoUInCa5fAgwuEBMIMBGvkkh.jpg,91.2315,"After his life is turned upside down when his wife is killed in a London terrorist attack, a brilliant but introverted CIA decoder takes matters into his own hands when his supervisors refuse to take action."
611251,Jokōsei torio: seikan shiken,1977-02-23,/9GSLrU0aoR6Pi2FQ0ttXV2thSxJ.jpg,88.7371,"Three high school girls. One is experienced, one has fantasies and one is curious. What more will they learn before graduation?"
1005860,Seeds,2024-10-25,/A0oZJp3CCqKSeNLhkXEtHUqDJmx.jpg,86.9053,A Mohawk woman is hired as a social media influencer but is caught in a deadly cat-and-mouse game as she's forced to go to war to preserve her people's heritage from corporate interests.
1071585,M3GAN 2.0,2025-06-25,/4a63rQqIDTrYNdcnTXdPsQyxVLo.jpg,84.0364,"After the underlying tech for M3GAN is stolen and misused by a powerful defense contractor to create a military-grade weapon known as Amelia, M3GAN's creator Gemma realizes that the only option is to resurrect M3GAN and give her a few upgrades, making her faster, stronger, and more lethal."
1412113,Squid Game: Making Season 2,2025-01-02,/yQGaui0bQ5Ai3KIFBB45nTeIqad.jpg,81.701,"From set designs to character arcs, get exclusive cast and director interviews on how Season 2 of the globally most-watched series was brought to life."
1426776,STRAW,2025-06-05,/t3cmnXYtxJb9vVL1ThvT2CWSe1n.jpg,80.834,What will be her last straw? A devastatingly bad day pushes a hardworking single mother to the breaking point — and into a shocking act of desperation.
1403735,Laila,2025-02-14,/l4gsNxFPGpzbq0D6QK1a8vO1lBz.jpg,80.3556,"Sonu Model, a renowned beautician from the old city, is forced to disguise himself as Laila, leading to a series of comedic, romantic, and action-packed events. Chaos ensues in this hilarious laugh riot"
1195518,The Unholy Trinity,2025-06-13,/gXYYIX5VesrDtR1iYJfvUnJBPLB.jpg,78.1072,"Set against the turbulent backdrop of 1870s Montana, in the moments before the execution of Isaac Broadway, he gives his estranged son, Henry, an impossible task: murder the man who framed him for a crime he didn’t commit. Intent on fulfilling his promise, Henry travels to the remote town of Trinity, where an unexpected turn of events traps him in town and leaves him caught between Gabriel Dove, the town’s upstanding new sheriff, and a mysterious figure named St. Christopher."
999243,Hell of a Summer,2025-04-03,/q9rRLc9pRDR8H6YoJTmXrBmivxD.jpg,77.2448,"When 24-year-old Jason Hochberg arrives for counsellor weekend at his beloved Camp Pineway, his biggest problem is feeling out of touch with his teenage co-workers. Little does he know; a masked killer has murdered camp owners John and Kathy and is preparing to strike again."
1181039,Candle in the Tomb: The Worm Valley,2023-09-22,/7Hk1qxAvZi9H9cfBb4iHkoGjapH.jpg,71.9145,"Adapted from the 3rd volume in the novel series ""Candle in the Tomb"" by Zhang Mu Ye. Hu Bayi, Wang Kaixuan, and Shiely Yang, infected with a curse, embark on a journey to King Xian's tomb to retrieve the Haochen Bead and break the curse. They face ancient organs, ghostly visions, explosive bugs, and a massive salamander."
713364,Clown in a Cornfield,2025-05-08,/dkIigNrQI5kklCC9Cv9b2Vpr1Q0.jpg,71.5925,"Quinn and her father have just moved to the quiet town of Kettle Springs hoping for a fresh start. Instead, she discovers a fractured community that has fallen on hard times after the treasured Baypen Corn Syrup Factory burned down. As the locals bicker amongst themselves and tensions boil over, a sinister, grinning figure emerges from the cornfields to cleanse the town of its burdens, one bloody victim at a time."
1376434,Predator: Killer of Killers,2025-06-05,/2XDQa6EmFHSA37j1t0w88vpWqj9.jpg,71.5707,"While three of the fiercest warriors in human history—a Viking raider, a ninja in feudal Japan, and a WWII pilot—are killers in their own right, they are merely prey for their new opponent: the ultimate killer of killers."
507086,Jurassic World Dominion,2022-06-01,/jbAvCACjLf1ZG0unB2tdmx5HAf1.jpg,71.2112,"Four years after Isla Nublar was destroyed, dinosaurs now live—and hunt—alongside humans all over the world. This fragile balance will reshape the future and determine, once and for all, whether human beings are to remain the apex predators on a planet they now share with history's most fearsome creatures."
870028,The Accountant²,2025-04-23,/kMDUS7VmFhb2coRfVBoGLR8ADBt.jpg,69.326,"When an old acquaintance is murdered, Wolff is compelled to solve the case. Realizing more extreme measures are necessary, Wolff recruits his estranged and highly lethal brother, Brax, to help. In partnership with Marybeth Medina, they uncover a deadly conspiracy, becoming targets of a ruthless network of killers who will stop at nothing to keep their secrets buried."
1197306,A Working Man,2025-03-26,/6FRFIogh3zFnVWn7Z6zcYnIbRcX.jpg,69.0322,"Levon Cade left behind a decorated military career in the black ops to live a simple life working construction. But when his boss's daughter, who is like family to him, is taken by human traffickers, his search to bring her home uncovers a world of corruption far greater than he ever could have imagined."
547016,The Old Guard,2020-07-09,/cjr4NWURcVN3gW5FlHeabgBHLrY.jpg,65.9649,Four undying warriors who've secretly protected humanity for centuries become targeted for their mysterious powers just as they discover a new immortal.
1257586,The Hangman,2024-05-30,/rij9Eh4RVXyPet8A1BNU8pDvtmu.jpg,65.2467,"Troubled father Leon takes son camping in Appalachia. Local cult summons evil Hangman demon. Son goes missing. Leon must confront cult, monster to find him amid rising body count."
1241982,Moana 2,2024-11-21,/aLVkiINlIeCkcZIzb7XHzPYgO6L.jpg,63.9606,"After receiving an unexpected call from her wayfinding ancestors, Moana journeys alongside Maui and a new crew to the far seas of Oceania and into dangerous, long-lost waters for an adventure unlike anything she's ever faced."
1063574,Misericordia,2024-10-16,/i1eFKvcUNdyNd53YeEOK2vNkBsL.jpg,63.0166,"Jérémie returns to his hometown for the funeral of his former boss, the village baker. He decides to stay for a few days with Martine, the man's widow. A mysterious disappearance, a threatening neighbor and a priest with strange intentions make Jérémie's short stay in the village take an unexpected turn."
1010581,My Fault,2023-06-08,/w46Vw536HwNnEzOa7J24YH9DPRS.jpg,62.2735,"Noah must leave her city, boyfriend, and friends to move into William Leister's mansion, the flashy and wealthy husband of her mother Rafaela. As a proud and independent 17 year old, Noah resists living in a mansion surrounded by luxury. However, it is there where she meets Nick, her new stepbrother, and the clash of their strong personalities becomes evident from the very beginning."
1504735,Squid Game in Conversation,2025-06-26,/gn1rd6ZTJSfVLGzPDqiBv2xNRjj.jpg,61.19,"Take a seat with the director and cast of Squid Game. Discover key moments, hear untold stories and see what this entire journey meant to them."
1450599,K.O.,2025-06-05,/qcM2sUiAeP4zXwx4ADSvgc9S58k.jpg,57.8261,"A former fighter must find the missing son of an opponent he accidentally killed years ago, taking on a brutally violent crime gang in Marseille."
1284120,The Ugly Stepsister,2025-03-07,/crX9rSg9EohybhkEe8iTQUCe55y.jpg,57.5967,"In a fairy-tale kingdom where beauty is a brutal business, Elvira battles to compete with her incredibly beautiful stepsister, and she will go to any length to catch the prince’s eye."
822119,Captain America: Brave New World,2025-02-12,/pzIddUEMWhWzfvLI3TwxUG2wGoi.jpg,57.5347,"After meeting with newly elected U.S. President Thaddeus Ross, Sam finds himself in the middle of an international incident. He must discover the reason behind a nefarious global plot before the true mastermind has the entire world seeing red."
447273,Snow White,2025-03-12,/xWWg47tTfparvjK0WJNX4xL8lW2.jpg,55.6555,"Following the benevolent King's disappearance, the Evil Queen dominated the once fair land with a cruel streak. Princess Snow White flees the castle when the Queen, in her jealousy over Snow White's inner beauty, tries to kill her. Deep into the dark woods, she stumbles upon seven magical dwarves and a young bandit named Jonathan. Together, they strive to survive the Queen's relentless pursuit and aspire to take back the kingdom."
1414272,Belyas,2025-02-07,/zPIaNQaQKtCIOs95x4GmaJ6omco.jpg,54.554,"Audrey Avila, Denise Esteban and Dani Yoshida star as sultry Belyas. A housewife who is tired of her controlling husband takes a different turn when two young prostitutes rent their apartment. As she befriends the two, she begins to admire the sexual freedom they have."
715287,Stepmom's Desire,2020-05-29,/rYC6UyML4CU4zYiZVbDMrwnGyWW.jpg,54.2499,"Sang-jin, who was envious of her neighbor after getting a beautiful wife, Ask your wife's friend Gian to take over the son's extracurricular teacher, Sang-jin, who left work early, accidentally sees Gian's shower. A man who wants to have sex with his son's tutor, And a son who wants to have a good time with a young stepmom, Ji-an and Jin-hee, who want money, are disappointed with her husband, and Bin-jin gives her body to a young son."
1239193,Deep Cover,2025-06-12,/1vXTHTbSQJs9r2hp4Uk08XzKwPp.jpg,53.3826,"Kat is an improv comedy teacher beginning to question if she’s missed her shot at success. When an undercover cop offers her the role of a lifetime, she recruits two of her students to infiltrate London’s gangland by impersonating dangerous criminals."
939243,Sonic the Hedgehog 3,2024-12-19,/d8Ryb8AunYAuycVKDp5HpdWPKgC.jpg,53.0147,"Sonic, Knuckles, and Tails reunite against a powerful new adversary, Shadow, a mysterious villain with powers unlike anything they have faced before. With their abilities outmatched in every way, Team Sonic must seek out an unlikely alliance in hopes of stopping Shadow and protecting the planet."
10191,How to Train Your Dragon,2010-03-18,/ygGmAO60t8GyqUo9xYeYxSZAR3b.jpg,52.602,"As the son of a Viking leader on the cusp of manhood, shy Hiccup Horrendous Haddock III faces a rite of passage: he must kill a dragon to prove his warrior mettle. But after downing a feared dragon, he realizes that he no longer wants to destroy it, and instead befriends the beast – which he names Toothless – much to the chagrin of his warrior father."
351286,Jurassic World: Fallen Kingdom,2018-06-06,/270MrJNqJovumHXGE6SSt0zwUIF.jpg,51.9785,"Three years after Jurassic World was destroyed, Isla Nublar now sits abandoned. When the island's dormant volcano begins roaring to life, Owen and Claire mount a campaign to rescue the remaining dinosaurs from this extinction-level event."
135397,Jurassic World,2015-06-06,/rhr4y79GpxQF9IsfJItRXVaoGs4.jpg,51.401,"Twenty-two years after the events of Jurassic Park, Isla Nublar now features a fully functioning dinosaur theme park, Jurassic World, as originally envisioned by John Hammond."
1470736,Open,2025-06-14,/A7TXvimVRgGiKsviUopqPLr3fY1.jpg,44.4654,"The perfect summer turns into a blood-soaked nightmare as counselors at an isolated camp are hunted by a killer and the truth behind the murders is darker than anyone imagined. If the killer doesn't get you, the drama definitely will."
1363224,Fear Cabin: The Last Weekend of Summer,2024-09-27,/gaSqrnpSnTq5oYno0KnDyDXAF5r.jpg,45.6681,"Six friends rent a cabin in the middle of the woods on the last weekend of summer and set out to have an amazing time full of partying and drinking. Little do they know that they will be sharing this cabin with an unexpected guest, will they make it out alive?"
1137350,The Phoenician Scheme,2025-05-23,/jtEqpy0K1iVuCebRwWqT6BZ6jLN.jpg,49.9667,"Wealthy businessman Zsa-zsa Korda appoints his only daughter, a nun, as sole heir to his estate. As Korda embarks on a new enterprise, they soon become the target of scheming tycoons, foreign terrorists, and determined assassins."
10191,How to Train Your Dragon,2010-03-18,/ygGmAO60t8GyqUo9xYeYxSZAR3b.jpg,52.602,"As the son of a Viking leader on the cusp of manhood, shy Hiccup Horrendous Haddock III faces a rite of passage: he must kill a dragon to prove his warrior mettle. But after downing a feared dragon, he realizes that he no longer wants to destroy it, and instead befriends the beast – which he names Toothless – much to the chagrin of his warrior father."
666154,Kayara,2025-01-02,/tpZdjnoJ6Z3NsSxI6HjAIggrcEv.jpg,49.0464,"A courageous and athletic teenager, Kayara dreams that she is destined to be the first female to break into the league of Chasquis - the official messengers of the Incan empire. As she learns what it takes to be a Chasqui along with its challenges, she tackles every mission she gets and discovers the ancient stories of her land and her people."
1414272,Belyas,2025-02-07,/zPIaNQaQKtCIOs95x4GmaJ6omco.jpg,54.554,"Audrey Avila, Denise Esteban and Dani Yoshida star as sultry Belyas. A housewife who is tired of her controlling husband takes a different turn when two young prostitutes rent their apartment. As she befriends the two, she begins to admire the sexual freedom they have."
1017163,The Roundup: Punishment,2024-04-24,/yk38mNoJpsswmk9o7i7eLhO4mc.jpg,46.967,'Monster Cop' Ma Seok-do investigates an illegal online gambling business led by a former STS Baek and an IT genius CEO Chang. Ma proposes an unexpected alliance to Jang and begins hunting down the criminals.
1022787,Elio,2025-06-18,/w2ARwtc1zoh0pyfwmyhpZHwuXgK.jpg,46.7516,"Elio, a space fanatic with an active imagination, finds himself on a cosmic misadventure where he must form new bonds with eccentric alien lifeforms, navigate a crisis of intergalactic proportions and somehow discover who he is truly meant to be."
1379587,Utopia,2024-12-09,/yef0tY1Nw3BX8PJTfBLieqHj5Hw.jpg,45.9229,"A soldier searching for his missing wife breaks into a high-tech facility, believing she's been caught in a human trafficking ring. But beyond its walls, he finds a surreal, futuristic fantasy park where reality and illusion blur. As he navigates this seductive and dangerous world, a shocking truth pulls him deeper into a deadly game where nothing is as it seems."
1240475,Hunt the Wicked,2024-07-18,/m5UBHbEjQJx3AkRZWRY6A4l4ZDT.jpg,46.2688,"The film tells the story of narcotics police officer Huang Mingjin and the ""mysterious figure"" Wei Yunzhou. Through completely different means and methods, in the process of calculating and wrestling with each other, they tear apart the facade of urban tranquility, exposing the underground drug network woven by the hidden hand ""Long Wang"", and ultimately eradicate the darkness with the sword of justice, revealing the dawn of light."
1289601,Life After Fighting,2024-06-07,/uKWAk4BHzyEOMmLKUDXoIAPhH36.jpg,45.3559,"Retired martial arts world champion Alex Faulkner has settled into a simple life, when the disappearance of two of his students leads to an unthinkable discovery close to home. Just when all hope of finding the children is lost, he locates the imprisoned girls and unsurfaces an international child trafficking operation, which draws him back into the fight of his life against those behind it."
1408248,Squid Game: Fireplace,2024-12-12,/cIIMvxLztRs1MbXH0oqaw3SGV0q.jpg,38.2646,"Come share a toast in the Front Man's lair — but tread carefully, for you’re playing with fire."
1022789,Inside Out 2,2024-06-11,/vpnVM9B6NMmQpWeZvzLvDESb2QY.jpg,45.3053,"Teenager Riley's mind headquarters is undergoing a sudden demolition to make room for something entirely unexpected: new Emotions! Joy, Sadness, Anger, Fear and Disgust, who’ve long been running a successful operation by all accounts, aren’t sure how to feel when Anxiety shows up. And it looks like she’s not alone."
1315988,Mikaela,2025-01-31,/xG8olkWOmoW78GbozKbS2UxYGEo.jpg,44.287,"During the eve of the 6th of January, a record-breaking snowstorm sweeps across Spain. In the midst of its chaos, a group of robbers seizes the opportunity to hijack an armoured van. A few meters away is Leo, a finished policeman who has nothing to lose. With the unexpected aid of a young woman, he will try to stop the band from running away with their loot."
