id,title,release_date,poster_path,popularity,overview
1208808,Night Shift,2024-12-05,/jnX2JQIbYwCLhHenhQFBFw6fozR.jpg,10.7681,"A young nurse with a domestic abuse past starts working the night shift at a small hospital, where, during the night, the ghost of a nurse materializes."
270946,Penguins of Madagascar,2014-11-22,/dXbpNrPDZDMEbujFoOxmMNQVMHa.jpg,10.1383,"Skipper, Kowalski, Rico and Private join forces with undercover organization The North Wind to stop the villainous Dr. Octavius Brine from destroying the world as we know it."
561,Constantine,2005-02-08,/vPYgvd2MwHlxTamAOjwVQp4qs1W.jpg,10.1326,"John Constantine has literally been to Hell and back. When he teams up with a policewoman to solve the mysterious suicide of her twin sister, their investigation takes them through the world of demons and angels that exists beneath the landscape of contemporary Los Angeles."
1159311,My Hero Academia: You're Next,2024-08-02,/8rdB1wkheEMMqcY8qLAKjCMPcnZ.jpg,10.1302,"In a society devastated by the effects of an all-out war between heroes and villains, a mysterious giant fortress suddenly appears, engulfing towns and people one after another. Then, a man reminiscent of All Might, the 'symbol of peace', stands in front of Izuku and his friends..."
1139566,Through My Window 3: Looking at You,2024-02-23,/gwpTgtwVAwmvivBN8rAQABpx9Am.jpg,10.13,"After the events of the summer, Ares and Raquel they don't see a way forward in their relationship and decide to go separate ways. But when they meet again in the winter in Barcelona, the love and desire they feel for each other is undeniable. Will they be able to find a way to get back together?"
337339,The Fate of the Furious,2017-04-12,/dImWM7GJqryWJO9LHa3XQ8DD5NH.jpg,10.1197,"When a mysterious woman seduces Dom into the world of crime and a betrayal of those closest to him, the crew face trials that will test them as never before."
1442538,Elevator Lady,2025-03-14,/4Q0eicxd5fq9llcoY2Mf8uUEE5r.jpg,10.1095,An elevator lady who uses her body to earn more money. She falls for a wealthy married man without her knowing that this will soon lead to her downfall.
10607,Don't Be a Menace to South Central While Drinking Your Juice in the Hood,1996-01-12,/HZQBF7JDd2e9p4rPSbSHuWHaCC.jpg,10.1069,"When Ashtray moves to South Central L.A. to live with his father (who appears to be the same age he is) and grandmother (who likes to talk tough and smoke reefer), he falls in with his gang-banging cousin Loc Dog, who along with the requisite pistols and Uzi carries a thermo-nuclear warhead for self-defense. Will Ashtray be able to keep living the straight life?"
153104,Wicked Minds,2003-03-01,/A6A15cDR8mpdOxW4y7UzFanzbM0.jpg,10.0905,Holden returns home from college and is surprised to find his overpowering competitive father married to a much younger woman Lana. Holden quickly falls for the beauty and charisma of his step mother. A passionate affair begins between son and stepmother.
1128655,The Surfer,2025-04-11,/5ZEksAUM9z3XcvzzA5mO9POyxMx.jpg,10.0892,"A man returns to the idyllic beach of his childhood to surf with his son. When he is humiliated by a group of locals, the man is drawn into a conflict that keeps rising and pushes him to his breaking point."
1255788,The Gardener,2025-01-30,/5T9WR7vIOnHm6xhVt5zBuPbBgt1.jpg,10.0856,"Every year the Prime Minister has a list of all kinds of troublemakers eliminated in the name of the famous Reason of State. Serge Shuster, Special Adviser to the President of the Republic, finds himself on this list, better known as the Matignon List.  Condemned to certain death and at the heart of an implacable plot and a state secret that also put his family in danger, Serge, his wife and children have only one hope left - their gardener, Léo, who hates it when « slugs » invade his garden... Especially those that want to kill innocent families."
257211,The Intern,2015-09-23,/9UoAC9tu8kIyRy8AcJnGhnH0gOH.jpg,10.0751,"70-year-old widower Ben Whittaker has discovered that retirement isn't all it's cracked up to be. Seizing an opportunity to get back in the game, he becomes a senior intern at an online fashion site, founded and run by Jules Ostin."
1101401,Sugar Baby,2024-10-15,/z7NyxmdJ1ypn3Y6BVizjGODuBdO.jpg,10.0614,"An enterprising Sugar Baby is offered $30,000 to move in with her Sugar Daddy for the week, but soon discovers the sinister secrets trapped within his home."
37799,The Social Network,2010-10-01,/n0ybibhJtQ5icDqTp8eRytcIHJx.jpg,10.0514,"In 2003, Harvard undergrad and computer programmer Mark Zuckerberg begins work on a new concept that eventually turns into the global social network known as Facebook. Six years later, Mark is one of the youngest billionaires ever, but his unprecedented success leads to both personal and legal complications when he ends up on the receiving end of two lawsuits, one involving his former friend."
50546,Just Go with It,2011-02-10,/ez1EDULOCUUCySHOZU6tz97qbtM.jpg,10.0265,"While romancing Palmer, a much younger schoolteacher, plastic surgeon Danny Maccabee enlists his loyal assistant Katherine to pretend to be his soon to be ex-wife, in order to cover up a careless lie. When more lies backfire, Katherine's kids become involved, and everyone heads off for a weekend in Hawaii that will change all their lives."
1111873,Abigail,2024-04-16,/5gKKSoD3iezjoL7YqZONjmyAiRA.jpg,10.0249,"A group of criminals kidnap a teenage ballet dancer, the daughter of a notorious gang leader, in order to obtain a ransom of $50 million, but over time, they discover that she is not just an ordinary girl. After the kidnappers begin to diminish, one by one, they discover, to their increasing horror, that they are locked inside with no normal little girl."
524434,Eternals,2021-11-03,/lFByFSLV5WDJEv3KabbdAF959F2.jpg,10.0218,"The Eternals are a team of ancient aliens who have been living on Earth in secret for thousands of years. When an unexpected tragedy forces them out of the shadows, they are forced to reunite against mankind’s most ancient enemy, the Deviants."
398818,Call Me by Your Name,2017-07-28,/gXiE0WveDnT0n5J4sW9TMxXF4oT.jpg,10.0189,"In the summer of 1983, a 17-year-old Elio spends his days in his family's villa in Italy. One day Oliver, a graduate student, arrives to assist Elio's father, a professor of Greco-Roman culture. Soon, Elio and Oliver discover a summer that will alter their lives forever."
1445276,A Love Too Captivating,2025-04-06,/zESBv0bTqtb4ICJ9oYn2HFec8JV.jpg,10.0144,"Misuzu was branded a delinquent when a small incident left him isolated. But one day, he sees the top student, Kitahara, get surrounded by bullies and decides to help him out. That sparked Kitahara's interest in the lonely boy, but Misuzu pushes Kitahara away. ""If you get involved with me, you'll get ostracized by everyone else too."" But it won't take long for Misuzu's resolve to falter..."
1448938,Abduct,2025-04-02,/94V8jjVPcywhy9KNQ9u9GdUU0Iv.jpg,10.0102,"A woman's peaceful mountain getaway takes a bizarre turn when her boyfriend disappears, and a random naked man shows up claiming to be him."
1260820,Stream,2024-02-06,/nnyjtBfUYA8ASHA9OhADrX0sMNQ.jpg,9.9999,"Craven, a streamer with thousands of followers on a live streaming platform, has prepared a very special stream for Halloween. What no one expects when reacting to a video of Pentagram, a group of young paranormal investigators, is that the live experience will turn into the worst night of their lives. And maybe... the last."
4935,Howl's Moving Castle,2004-09-09,/23hUJh7JdO23SpgUB5oiFDQk2wX.jpg,13.4737,"Sophie, a young milliner, is turned into an elderly woman by a witch who enters her shop and curses her. She encounters a wizard named Howl and gets caught up in his resistance to fighting for the king."
299054,Expend4bles,2023-09-15,/iwsMu0ehRPbtaSxqiaUDQB9qMWT.jpg,8.6239,"Armed with every weapon they can get their hands on and the skills to use them, The Expendables are the world’s last line of defense and the team that gets called when all other options are off the table. But new team members with new styles and tactics are going to give “new blood” a whole new meaning."
812,Aladdin,1992-11-25,/eLFfl7vS8dkeG1hKp5mwbm37V83.jpg,9.9566,"In the boorish city of Agrabah, kind-hearted street urchin Aladdin and Princess Jasmine fall in love, although she can only marry a prince. He and power-hungry Grand Vizier Jafar vie for a magic lamp that can fulfill their wishes."
4922,The Curious Case of Benjamin Button,2008-12-25,/26wEWZYt6yJkwRVkjcbwJEFh9IS.jpg,10.635,"Born under unusual circumstances, Benjamin Button springs into being as an elderly man in a New Orleans nursing home and ages in reverse. Twelve years after his birth, he meets Daisy, a child who flits in and out of his life as she grows up to be a dancer. Though he has all sorts of unusual adventures over the course of his life, it is his relationship with Daisy, and the hope that they will come together at the right time, that drives Benjamin forward."
180,Minority Report,2002-06-20,/ccqpHq5tk5W4ymbSbuoy4uYOxFI.jpg,9.3857,"John Anderton is a top 'Precrime' cop in the late-21st century, when technology can predict crimes before they're committed. But Anderton becomes the quarry when another investigator targets him for a murder charge."
263115,Logan,2017-02-28,/fnbjcRDYn6YviCcePDnGdyAkYsB.jpg,9.9441,"In the near future, a weary Logan cares for an ailing Professor X in a hideout on the Mexican border. But Logan's attempts to hide from the world and his legacy are upended when a young mutant arrives, pursued by dark forces."
1979,Fantastic Four: Rise of the Silver Surfer,2007-06-13,/f3ldtPF7SESMcyAIyIJHBLlBBkr.jpg,9.8983,"The Fantastic Four return to the big screen as a new and all powerful enemy threatens the Earth. The seemingly unstoppable 'Silver Surfer', but all is not what it seems and there are old and new enemies that pose a greater threat than the intrepid superheroes realize."
131634,The Hunger Games: Mockingjay - Part 2,2015-11-18,/7uLJCuK0ufoDklUdOORC8XanOKw.jpg,11.2408,"With the nation of Panem in a full scale war, Katniss confronts President Snow in the final showdown. Teamed with a group of her closest friends – including Gale, Finnick, and Peeta – Katniss goes off on a mission with the unit from District 13 as they risk their lives to stage an assassination attempt on President Snow who has become increasingly obsessed with destroying her. The mortal traps, enemies, and moral choices that await Katniss will challenge her more than any arena she faced in The Hunger Games."
545611,Everything Everywhere All at Once,2022-03-24,/u68AjlvlutfEIcpmbYpKcdi09ut.jpg,11.0771,"An aging Chinese immigrant is swept up in an insane adventure, where she alone can save what's important to her by connecting with the lives she could have led in other universes."
335977,Indiana Jones and the Dial of Destiny,2023-06-25,/Af4bXE63pVsb2FtbW8uYIyPBadD.jpg,10.2065,"Finding himself in a new era, and approaching retirement, Indy wrestles with fitting into a world that seems to have outgrown him. But as the tentacles of an all-too-familiar evil return in the form of an old rival, Indy must don his hat and pick up his whip once more to make sure an ancient and powerful artifact doesn't fall into the wrong hands."
9757,Norbit,2007-02-08,/XcZ5NzygPp54csxCnzvQKuxFL2.jpg,8.4913,"A mild-mannered guy who is engaged to a monstrous woman meets the woman of his dreams, and schemes to find a way to be with her."
3597,I Know What You Did Last Summer,1997-10-17,/nBXwFJOp3Qlmk6ZDKl1PLCDh0FC.jpg,8.6149,"After an accident on a winding road, four teens make the fatal mistake of dumping their victim's body into the sea. Exactly one year later, the deadly secret resurfaces as they're stalked by a hook-handed figure."
140607,Star Wars: The Force Awakens,2015-12-15,/wqnLdwVXoBjKibFRR5U3y0aDUhs.jpg,9.9792,"Thirty years after defeating the Galactic Empire, Han Solo and his allies face a new threat from the evil Kylo Ren and his army of Stormtroopers."
76492,Hotel Transylvania,2012-09-20,/3sKT6vtydJ4DkTJtdP5pvfpPa0n.jpg,10.1386,"Welcome to Hotel Transylvania, Dracula's lavish five-stake resort, where monsters and their families can live it up and no humans are allowed. One special weekend, Dracula has invited all his best friends to celebrate his beloved daughter Mavis's 118th birthday. For Dracula catering to all of these legendary monsters is no problem but the party really starts when one ordinary guy stumbles into the hotel and changes everything!"
988078,Through My Window: Across the Sea,2023-06-23,/6GyzbZf1MsXfrDWTnNXrzwr6G9q.jpg,8.946,"After a year of long-distance, Raquel and Ares reunite on a steamy beach trip. Faced with fresh flirtations and insecurities, will their love prevail?"
1043758,The Problem with People,2024-10-04,/18tgLakMGWCjhGJKwby53wh5tpp.jpg,9.6013,Two estranged cousins who never knew each other try to make amends for many generations of family dispute.
372049,My Friend's Wife,2015-12-03,/6BZKRq3bvTOuG4G01H1jcE0F5TG.jpg,10.5045,"I want to spend all night with my friend's wife who is extremely sexy. Jeong-woo is a husband who can't get an erection while his marriage is going down the drain.  A friend and his wife from the States suggest a couples trip and Jeong-woo meets his friend's wife Hye-sook who is extremely sexy. His 'package' keeps getting stimlated every time he sees her. He tries to ignore it but every time he sees her, he gets sexual fantasies. Finally, he suggests to his friend, to 'switch' partners..."
1147710,Hijack 1971,2024-06-21,/68jNkFi61MQjrJEqj2up5wZ4w5R.jpg,9.7037,"Pilots Tae-in and Gyu-sik are set to fly to Gimpo. Under the guidance of flight attendant Ok-soon, passengers are busy boarding. However, shortly after takeoff, a homemade bomb explodes, turning the cabin into chaos."
1226406,Love Hurts,2025-02-06,/skPPVeHoTTVVSJlb0Ib5vrqiuA4.jpg,10.153,"A realtor is pulled back into the life he left behind after his former partner-in-crime resurfaces with an ominous message. With his crime-lord brother also on his trail, he must confront his past and the history he never fully buried."
1222064,River of Blood,2024-08-29,/7lkm4eAvHy1uCs48GEwMxgwNdgd.jpg,10.3381,Four kayakers take the wrong river into a jungle inhabited by a tribe of merciless cannibals.
937278,A Man Called Otto,2022-12-28,/130H1gap9lFfiTF9iDrqNIkFvC9.jpg,9.869,"When a lively young family moves in next door, grumpy widower Otto Anderson meets his match in a quick-witted, pregnant woman named Marisol, leading to an unlikely friendship that turns his world upside down."
679,Aliens,1986-07-18,/r1x5JGpyqZU8PYhbs4UcrO1Xb6x.jpg,9.8678,"Ripley, the sole survivor of the Nostromo's deadly encounter with the monstrous Alien, returns to Earth after drifting through space in hypersleep for 57 years. Although her story is initially met with skepticism, she agrees to accompany a team of Colonial Marines back to LV-426."
1078600,Marked Men: Rule + Shaw,2025-01-22,/gZQU8BtCH2IbMZq6QETiU4HXQSR.jpg,9.8641,"Shaw Landon has loved Rule Archer from the moment she laid eyes on him. Rule, a fiery-tempered rebel tattoo artist, doesn’t have time for a good girl pre-med student like Shaw — even if she’s the only one who can see the person he truly is. She lives by other people’s rules; he makes his own. But a short skirt, too many birthday cocktails, and spilled secrets lead to a night neither can forget. Now, Shaw and Rule must figure out how a girl like her and a guy like him are supposed to be together without destroying their love…or each other."
1020414,Peter Pan's Neverland Nightmare,2025-01-13,/5THDVistCJttsfCUOt6DBucY0ed.jpg,9.8433,"Wendy Darling strikes out in an attempt to rescue her brother Michael from the clutches of the evil Peter Pan who intends to send him to Neverland. Along the way she meets a twisted Tinkerbell, who is hooked on what she thinks is fairy dust."
420817,Aladdin,2019-05-22,/ykUEbfpkf8d0w49pHh0AD2KrT52.jpg,9.8321,A kindhearted street urchin named Aladdin embarks on a magical adventure after finding a lamp that releases a wisecracking genie while a power-hungry Grand Vizier vies for the same lamp that has the power to make their deepest wishes come true.
381284,Hidden Figures,2016-12-10,/9lfz2W2uGjyow3am00rsPJ8iOyq.jpg,9.8247,"The untold story of Katherine G. Johnson, Dorothy Vaughan and Mary Jackson – brilliant African-American women working at NASA and serving as the brains behind one of the greatest operations in history – the launch of astronaut John Glenn into orbit. The visionary trio crossed all gender and race lines to inspire generations to dream big."
87101,Terminator Genisys,2015-06-23,/oZRVDpNtmHk8M1VYy1aeOWUXgbC.jpg,9.8159,"The year is 2029. John Connor, leader of the resistance continues the war against the machines. At the Los Angeles offensive, John's fears of the unknown future begin to emerge when TECOM spies reveal a new plot by SkyNet that will attack him from both fronts; past and future, and will ultimately change warfare forever."
955,Mission: Impossible II,2000-05-24,/hfnrual76gPeNFduhD4xzHWpfTw.jpg,9.8014,"With computer genius Luther Stickell at his side and a beautiful thief on his mind, agent Ethan Hunt races across Australia and Spain to stop a former IMF agent from unleashing a genetically engineered biological weapon called Chimera. This mission, should Hunt choose to accept it, plunges him into the center of an international crisis of terrifying magnitude."
77,Memento,2000-10-11,/fKTPH2WvH8nHTXeBYBVhawtRqtR.jpg,9.7993,"Leonard Shelby is tracking down the man who raped and murdered his wife. The difficulty of locating his wife's killer, however, is compounded by the fact that he suffers from a rare, untreatable form of short-term memory loss. Although he can recall details of life before his accident, Leonard cannot remember what happened fifteen minutes ago, where he's going, or why."
381288,Split,2017-01-19,/lli31lYTFpvxVBeFHWoe5PMfW5s.jpg,9.7932,"Though Kevin has evidenced 23 personalities to his trusted psychiatrist, Dr. Fletcher, there remains one still submerged who is set to materialize and dominate all the others. Compelled to abduct three teenage girls led by the willful, observant Casey, Kevin reaches a war for survival among all of those contained within him — as well as everyone around him — as the walls between his compartments shatter apart."
232672,Blended,2014-05-21,/o2YrH9jS7CAfWjETHFeL0tth79E.jpg,9.7915,"Recently divorced mom Lauren and widowed dad Jim let their friends push them into a blind date, which goes disastrously wrong. Unsurprisingly, neither wants to see the other ever again. However, fate intervenes when both Jim and Lauren, unbeknownst to each other, purchase one-half of the same vacation package at a South African resort for families, during spring break. They and their children are forced to share the same romantic suite and participate in a slew of family activities together."
18,The Fifth Element,1997-05-02,/fPtlCO1yQtnoLHOwKtWz7db6RGU.jpg,9.79,"In 2257, a taxi driver is unintentionally given the task of saving a young girl who is part of the key that will ensure the survival of humanity."
204082,Homefront,2013-11-12,/6pF8D9bDIAmuHgCqGKEfuNWRQam.jpg,9.7895,"Phil Broker is a former DEA agent who has gone through a crisis after his action against a biker gang went horribly wrong and it cost the life of his boss' son. He is recently widowed and is left with a 9-years-old daughter, Maddy. He decides to quit the turbulent and demanding life of thrill for Maddy's sake and retires to a small town. His daughter fights off a boy who was bullying her at school and this sets in motion a round of events that end in his direct confrontation with the local Meth drug lord. His past history with the biker gang also enters the arena, making matters more complex. But he has a mission in his mind to protect his daughter and he is ready to pay any cost that it demands."
420809,Maleficent: Mistress of Evil,2019-10-16,/vloNTScJ3w7jwNwtNGoG8DbTThv.jpg,9.7889,"Maleficent and her goddaughter Aurora begin to question the complex family ties that bind them as they are pulled in different directions by impending nuptials, unexpected allies, and dark new forces at play."
1291559,Drawing Closer,2024-06-26,/173FD4a0rpSF30z4CoWx6qdx8Ry.jpg,9.7788,"With only a year left to live, 17-year-old Akito finds new meaning in life by bringing joy to a terminally ill girl who has just six months remaining."
93685,Swingers,2002-10-01,/vsctdCbDHApN003Fs3QzJB8Nl9B.jpg,9.7524,"Despite Diana's insecure nature, she and her husband Julian agree with the idea to sexually experiment with another couple. They put out an ad on the net to which the well experienced Alex and Timo react. We follow Diana and Julian as they prepare for the arrival of Alex and Timo, who they have invited to their home for the weekend. Diana is nervous. As soon as she is confronted with the self-confident and ravishingly sexy Alex, her insecurity increases even more. Timo seems disinterested, a sharp contrast to the boyish excitement of Julian. But as night falls and their sexual exploration begins, we notice Timo may not be as casual as he initially seemed and Diana on the other hand contains hidden strength. And so we realize there's more to 'Swingers' than just sex. Swingers: could your relationship stand the test?"
80321,Madagascar 3: Europe's Most Wanted,2012-06-06,/ekraj4ksvIKeuvQVEevEJkuybZd.jpg,9.7517,"Animal pals Alex, Marty, Melman, and Gloria are still trying to make it back to New York's Central Park Zoo. They are forced to take a detour to Europe to find the penguins and chimps who broke the bank at a Monte Carlo casino. When French animal-control officer Capitaine Chantel DuBois picks up their scent, Alex and company are forced to hide out in a traveling circus."
1422,The Departed,2006-10-04,/nT97ifVT2J1yMQmeq20Qblg61T.jpg,9.7446,"To take down South Boston's Irish Mafia, the police send in one of their own to infiltrate the underworld, not realizing the syndicate has done likewise. While an undercover cop curries favor with the mob kingpin, a career criminal rises through the police ranks. But both sides soon discover there's a mole among them."
1410082,Sniper: The Last Stand,2025-01-21,/TVvIyCsFCmLk9MRLbAZi4X8f32.jpg,9.7433,"To stop an arms dealer from unleashing a deadly superweapon, Ace sniper Brandon Beckett and Agent Zero are deployed to Costa Verde to lead a group of elite soldiers against an unrelenting militia. Taking an untested sniper under his wing, Beckett faces his newest challenge: giving orders instead of receiving them. With both time and ammo running low in a race to save humanity, the team must overcome all odds just to survive."
93456,Despicable Me 2,2013-06-26,/oyMPJJZoOpLHgJoFPUOn6DgkbWJ.jpg,9.7403,Gru is recruited by the Anti-Villain League to help deal with a powerful new super criminal.
286687,Love Lesson,2013-12-05,/xw1ygSZtjJLD0UkspIQghV7yqE4.jpg,9.7384,"Korea's most popular song writer Hee-soo runs into a nineteen-year-old boy in the elevator. Hee-soo is inspired by a new song watching him shake at her figure. She starts to tell him about women under the excuse that she's teaching him music. They fall for each other but things get complicated when her life teacher, Joon-ho who taught her about life and music comes back."
487297,What Men Want,2019-02-08,/30IiwvIRqPGjUV0bxJkZfnSiCL.jpg,9.7355,"Magically able to hear what men are thinking, a sports agent uses her newfound ability to turn the tables on her overbearing male colleagues."
480530,Creed II,2018-11-21,/v3QyboWRoA4O9RbcsqH8tJMe8EB.jpg,9.7342,"Between personal obligations and training for his next big fight against an opponent with ties to his family's past, Adonis Creed is up against the challenge of his life."
10591,The Girl Next Door,2004-04-09,/5mVyFHSY2rSsNgD4NfEwV82HigU.jpg,9.7332,"Exceptionally ambitious high schooler Matthew has aspirations for a career in politics when he falls in love with his gorgeous 19-year-old neighbor, Danielle. But Matthew's bright future is jeopardized when he finds Danielle was once a porn star. As Danielle's past catches up with her, Matthew's love for her forces him to re-evaluate his goals."
383498,Deadpool 2,2018-05-15,/to0spRl1CMDvyUbOnbb4fTk3VAd.jpg,9.7316,Wisecracking mercenary Deadpool battles the evil and powerful Cable and other bad guys to save a boy's life.
613504,After We Collided,2020-09-02,/kiX7UYfOpYrMFSAGbI6j1pFkLzQ.jpg,9.7303,Tessa finds herself struggling with her complicated relationship with Hardin; she faces a dilemma that could change their lives forever.
1003596,Avengers: Doomsday,2026-12-18,/6eB2oh1SplddsZYCdayrIdrIGLd.jpg,9.727,"The Avengers, Wakandans, Fantastic Four, Thunderbolts, and X-Men all fight against Doctor Doom. Plot TBA."
957,Spaceballs,1987-06-24,/o624HTt93iIJIc1Sg5hNkDTnk5l.jpg,9.7267,"When the nefarious Dark Helmet hatches a plan to snatch Princess Vespa and steal her planet's air, space-bum-for-hire Lone Starr and his clueless sidekick fly to the rescue. Along the way, they meet Yogurt, who puts Lone Starr wise to the power of ""The Schwartz."" Can he master it in time to save the day?"
14869,G.I. Joe: The Rise of Cobra,2009-08-03,/wEr0FAAKPjlZ63i2WuuB2ge8OWv.jpg,9.7163,"From the Egyptian desert to deep below the polar ice caps, the elite G.I. JOE team uses the latest in next-generation spy and military equipment to fight the corrupt arms dealer Destro and the growing threat of the mysterious Cobra organization to prevent them from plunging the world into chaos."
